kanji;strokes;grade;freq;jlpt_old;jlpt_new;meanings;readings_on;readings_kun;wk_level;wk_meanings;wk_readings_on;wk_readings_kun;wk_radicals;fr_meanings
担;8;6.0;422.0;2.0;2.0;[Shouldering, Carry, Raise, Bear];[たん];[かつ.ぐ, にな.う];24;[Carry, Bear];[たん];[にな, かつ];[Fingers, Dawn];porter sur le dos, supporter se charger de
好;6;4.0;423.0;3.0;3.0;[Fond, Pleasing, Like Something];[こう];[この.む, す.く, よ.い, い.い];11;[Like];[こう];[す, この];[Woman, Child];aimé, apprécié
退;9;5.0;424.0;2.0;3.0;[Retreat, Withdraw, Retire, Resign, Repel, Expel, Reject];[たい];[しりぞ.く, しりぞ.ける, ひ.く, の.く, の.ける, ど.く];27;[Retreat, Reject];[たい];[しりぞ, ひ, ど, の];[Scooter, Root];retraite, retirement
準;13;5.0;425.0;2.0;2.0;[Semi-, Correspond To, Proportionate To, Conform, Imitate];[じゅん];[じゅん.じる, じゅん.ずる, なぞら.える, のり, ひと.しい, みずもり];23;[Standard];[じゅん];[];[Tsunami, Turkey, Cross];semi-, quasi-, correspondant à
賞;15;4.0;426.0;2.0;2.0;[Prize, Reward, Praise];[しょう];[ほ.める];13;[Prize];[しょう];[];[Viking, Mouth, Shellfish];prix, récompense
訴;12;8.0;427.0;1.0;1.0;[Accusation, Sue, Complain Of Pain, Appeal To];[そ];[うった.える];25;[Sue];[そ];[うった];[Say, Axe, Drop];porter plainte, attaquer en justice, se plaindre
辺;5;4.0;428.0;2.0;2.0;[Environs, Boundary, Border, Vicinity];[へん];[あた.り, ほと.り, -べ];7;[Area];[へん];[あた, べ];[Scooter, Sword];les environs, voisinage, parages
造;10;5.0;429.0;2.0;2.0;[Create, Make, Structure, Physique];[ぞう];[つく.る, つく.り, -づく.り];26;[Create];[ぞう];[つく];[Scooter, Announce];construction, structure
英;8;4.0;430.0;3.0;4.0;[England, English, Hero, Outstanding, Calyx];[えい];[はなぶさ];15;[England, English];[えい];[];[Flowers, Center];Grande-Bretagne, brillant, talentueux
被;10;8.0;431.0;2.0;2.0;[Incur, Cover, Veil, Brood Over, Shelter, Wear, Put On, Be Exposed (film), Receiving];[ひ];[こうむ.る, おお.う, かぶ.る, かぶ.せる];20;[Incur];[ひ];[かぶ];[Spirit, Skin];coiffer, être coiffé de porter, endurer, subir
株;10;6.0;432.0;1.0;1.0;[Stocks, Stump, Shares, Stock, Counter For Small Plants];[しゅ];[かぶ];24;[Stocks, Shares];[しゅ];[かぶ];[Tree, Slide, Jet];plant, souche, action, titre
頭;16;2.0;433.0;3.0;3.0;[Head, Counter For Large Animals];[とう, ず, と];[あたま, かしら, -がしら, かぶり];10;[Head];[ず, とう];[あたま];[Beans, Geoduck];tête, compteur pour les gros animaux
技;7;5.0;434.0;2.0;2.0;[Skill, Art, Craft, Ability, Feat, Performance, Vocation, Arts];[ぎ];[わざ];14;[Skill];[ぎ];[わざ];[Fingers, Branch];technique, habileté, prouesse, habileté
低;7;4.0;435.0;3.0;2.0;[Lower, Short, Humble];[てい];[ひく.い, ひく.める, ひく.まる];11;[Low];[てい];[ひく];[Leader, Clan, Ground];bas, abaisser, s'abaisser
毎;6;2.0;436.0;4.0;5.0;[Every];[まい];[ごと, -ごと.に];5;[Every];[まい];[ごと];[Gun, Window];chaque, tous les...
医;7;3.0;437.0;3.0;4.0;[Doctor, Medicine];[い];[い.やす, い.する, くすし];8;[Medicine];[い];[];[Cage, Arrow];médecine, soin
復;12;5.0;438.0;2.0;2.0;[Restore, Return To, Revert, Resume];[ふく];[また];26;[Restore];[ふく];[];[Loiter, Black Hole];retourner, répéter
仕;5;3.0;439.0;3.0;4.0;[Attend, Doing, Official, Serve];[し, じ];[つか.える];4;[Doing, Do];[し];[つか];[Leader, Samurai];servir, être au service de
去;5;3.0;440.0;3.0;4.0;[Gone, Past, Quit, Leave, Elapse, Eliminate, Divorce];[きょ, こ];[さ.る, -さ.る];4;[Past];[きょ, こ];[さ];[Dirt, Private];quitter, passé
姿;9;6.0;441.0;1.0;1.0;[Figure, Form, Shape];[し];[すがた];22;[Figure, Shape, Form];[し];[すがた];[Next, Woman];forme, silhouette, apparence
味;8;3.0;442.0;3.0;4.0;[Flavor, Taste];[み];[あじ, あじ.わう];11;[Flavor, Taste];[み];[あじ];[Mouth, Jet];goût, saveur goûter, apprécier la saveur de
負;9;3.0;443.0;2.0;3.0;[Defeat, Negative, -, Minus, Bear, Owe, Assume A Responsibility];[ふ];[ま.ける, ま.かす, お.う];9;[Lose];[ふ];[ま, お];[Prison, Shellfish];perdre, baisser le prix vaincre porter, assumer
閣;14;6.0;444.0;1.0;1.0;[Tower, Tall Building, Palace];[かく];[];29;[The Cabinet, Cabinet];[かく];[];[Gate, Kiss];construction élevée, palais, édifice officiel
韓;18;8.0;445.0;;;[Korea];[かん];[から, いげた];29;[Korea];[かん];[];[Korea, Morning];la Corée
渡;12;8.0;446.0;2.0;3.0;[Transit, Ford, Ferry, Cross, Import, Deliver, Diameter, Migrate];[と];[わた.る, -わた.る, わた.す];25;[Transit];[と];[わた];[Tsunami, Yurt, Stool];traverser, passer rendre, donner
失;5;4.0;447.0;2.0;3.0;[Lose, Error, Fault, Disadvantage, Loss];[しつ];[うしな.う, う.せる];7;[Fault];[しつ];[うしな];[Slide, Husband];erreur, échec, perte
移;11;5.0;448.0;2.0;2.0;[Shift, Move, Change, Drift, Catch (cold, Fire), Pass Into],;[い];[うつ.る, うつ.す];28;[Shift];[い];[うつ];[Grain, Evening];se déplacer, se transporter transporter, transférer
差;10;4.0;449.0;2.0;3.0;[Distinction, Difference, Variation, Discrepancy, Margin, Balance];[さ];[さ.す, さ.し];24;[Distinction];[さ];[さ];[Horns, King, Slide, Construction];différence, reste désigner, porter (une arme), verser
衆;12;6.0;450.0;1.0;1.0;[Masses, Great Numbers, Multitude, Populace];[しゅう, しゅ];[おお.い];28;[Populace];[しゅう];[];[Blood, Hair, Tofu];grand nombre, multitude, foule
個;10;5.0;451.0;2.0;2.0;[Individual, Counter For Articles];[こ, か];[];20;[Individual];[こ];[];[Leader, Mouth, Old];individuel compteur des petits objets
門;8;2.0;452.0;3.0;2.0;[Gate, Counter For Cannons];[もん];[かど, と];16;[Gates, Gate];[もん];[];[Gate];porte, entrée
写;5;3.0;453.0;3.0;4.0;[Copy, Be Photographed, Describe];[しゃ, じゃ];[うつ.す, うつ.る, うつ-, うつ.し];4;[Copy];[しゃ];[うつ];[Forehead, Ground, Beggar];copier, reproduire, imiter
評;12;5.0;454.0;2.0;1.0;[Evaluate, Criticism, Comment];[ひょう];[];21;[Evaluate];[ひょう];[];[Say, Peace];critique, commentaire
課;15;4.0;455.0;2.0;2.0;[Chapter, Lesson, Section, Department, Division, Counter For Chapters (of A Book)];[か];[];13;[Section];[か];[];[Say, Fruit];section, partie, leçon
末;5;4.0;456.0;2.0;3.0;[End, Close, Tip, Powder, Posterity];[まつ, ばつ];[すえ];7;[End];[まつ];[すえ];[Jet];fin, extrémité, bout
守;6;3.0;457.0;2.0;3.0;[Guard, Protect, Defend, Obey];[しゅ, す];[まも.る, まも.り, もり, -もり, かみ];16;[Protect];[す, しゅ];[まも, もり];[Roof, Measurement];garder, protéger, conserver gardien
若;8;6.0;458.0;2.0;3.0;[Young, If, Perhaps, Possibly, Low Number, Immature];[じゃく, にゃく, にゃ];[わか.い, わか-, も.しくわ, も.し, も.しくは, ごと.し];19;[Young];[じゃく];[わか, も];[Flowers, Right];jeune ou (bien)
脳;11;6.0;459.0;2.0;2.0;[Brain, Memory];[のう, どう];[のうずる];18;[Brain];[のう];[];[Moon, Grass, Treasure Chest];cerveau
極;12;4.0;460.0;2.0;2.0;[Poles, Settlement, Conclusion, End, Highest Rank, Electric Poles, Very, Extremely, Most, Highly, 10**48];[きょく, ごく];[きわ.める, きわ.まる, きわ.まり, きわ.み, き.める, -ぎ.め, き.まる];27;[Extreme];[きょく, ごく];[きわ];[Tree, Beggar, Mouth, Stool, Ground];pôle, très extrêmement hauteur, extrême porter, arriver à l'extrême
種;14;4.0;461.0;2.0;3.0;[Species, Kind, Class, Variety, Seed];[しゅ];[たね, -ぐさ];18;[Kind, Type];[しゅ];[たね, ぐさ];[Grain, Heavy];variété, sorte, type graine, semence, cause
美;9;3.0;462.0;2.0;3.0;[Beauty, Beautiful];[び, み];[うつく.しい];9;[Beauty, Beautiful];[び, み];[うつく];[Horns, King, Big];beau, excellent
岡;8;8.0;463.0;;;[Mount, Hill, Knoll];[こう];[おか];21;[Hill];[];[おか];[Head, Horns, Ground, Mountain];colline
影;15;8.0;464.0;1.0;1.0;[Shadow, Silhouette, Phantom];[えい];[かげ];25;[Shadow];[えい];[かげ];[Sun, Capital, Hair];ombre, image, lumière, silhouette
命;8;3.0;465.0;2.0;3.0;[Fate, Command, Decree, Destiny, Life, Appoint];[めい, みょう];[いのち];11;[Fate];[めい, みょう];[いのち];[Orders, Mouth];vie, destin, ordre, commandement
含;7;8.0;466.0;2.0;2.0;[Contain, Include, Hold In The Mouth, Bear In Mind, Understand, Cherish];[がん];[ふく.む, ふく.める];25;[Include];[がん];[ふく];[Now, Mouth];contenir, garder, inclure inclure, donner des instructions
福;13;3.0;467.0;2.0;3.0;[Blessing, Fortune, Luck, Wealth];[ふく];[];13;[Luck, Fortune];[ふく];[];[Spirit, Scarecrow];fortune, félicité, bonheur
蔵;15;6.0;468.0;2.0;2.0;[Storehouse, Hide, Own, Have, Possess];[ぞう, そう];[くら, おさ.める, かく.れる];33;[Storehouse];[ぞう];[くら];[Storehouse];entrepôt, magasin
量;12;4.0;469.0;2.0;2.0;[Quantity, Measure, Weight, Amount, Consider, Estimate, Surmise];[りょう];[はか.る];24;[Quantity, Amount];[りょう];[はか];[Dawn, Village];quantité, volume mesurer, peser
望;11;4.0;470.0;2.0;3.0;[Ambition, Full Moon, Hope, Desire, Aspire To, Expect];[ぼう, もう];[のぞ.む, もち];14;[Hope];[ぼう];[のぞ];[Death, Moon, King];souhaiter, désirer
松;8;4.0;471.0;1.0;1.0;[Pine Tree];[しょう];[まつ];14;[Pine, Pine Tree];[しょう];[まつ];[Tree, Public];pin, résineux
非;8;5.0;472.0;2.0;3.0;[Un-, Mistake, Negative, Injustice, Non-];[ひ];[あら.ず];17;[Injustice, Negative, Mistake];[ひ];[];[Criminal];tort, faute, erreur, non-
撃;15;8.0;473.0;1.0;1.0;[Beat, Attack, Defeat, Conquer];[げき];[う.つ];28;[Attack];[げき];[う];[Car, Weapon, Hand];attaquer, faire feu, tirer avec une arme
佐;7;8.0;474.0;1.0;1.0;[Assistant, Help];[さ];[];47;[Help];[さ];[];[Leader, Narwhal, Construction];aide
核;10;8.0;475.0;1.0;1.0;[Nucleus, Core, Kernel];[かく];[];36;[Nucleus];[かく];[];[Tree, Slice];noyau, coeur, âme
観;18;4.0;476.0;2.0;3.0;[Outlook, Look, Appearance, Condition, View];[かん];[み.る, しめ.す];22;[View];[かん];[み];[Arrow, Turkey, See];aspect, vue, apparence
察;14;4.0;477.0;2.0;3.0;[Guess, Presume, Surmise, Judge, Understand];[さつ];[];17;[Guess];[さつ];[さっ];[Roof, Festival];supposer, deviner, comprendre, juger
整;16;3.0;478.0;2.0;1.0;[Organize, Arranging, Tune, Tone, Meter, Key (music)];[せい];[ととの.える, ととの.う];13;[Arrange, Organize];[せい];[ととの];[Bundle, Winter, Correct];être en ordre, être réuni mettre en ordre
段;9;6.0;479.0;2.0;3.0;[Grade, Steps, Stairs];[だん, たん];[];27;[Steps, Stairs];[だん];[];[Comb, Weapon];étape, degré, rang
横;15;3.0;480.0;2.0;3.0;[Sideways, Side, Horizontal, Width, Woof, Unreasonable, Perverse];[おう];[よこ];10;[Side, Horizontal];[おう];[よこ];[Tree, Yellow];côté, flanc, horizontal
融;16;8.0;481.0;1.0;1.0;[Dissolve, Melt];[ゆう];[と.ける, と.かす];31;[Dissolve];[ゆう];[];[Bully, Insect];fondre, circuler
型;9;4.0;482.0;2.0;2.0;[Mould, Type, Model];[けい];[かた, -がた];24;[Model, Type];[けい];[かた];[Lantern, Knife, Dirt];type, modèle, moule
白;5;1.0;483.0;4.0;5.0;[White];[はく, びゃく];[しろ, しら-, しろ.い];2;[White];[はく];[しろ, しら];[White];blanc, pureté
深;11;3.0;484.0;2.0;3.0;[Deep, Heighten, Intensify, Strengthen];[しん];[ふか.い, -ぶか.い, ふか.まる, ふか.める, み-];12;[Deep];[しん];[ふか];[Tsunami, Pi, Tree];profond, intense, profondeur, approfondir, s'approfondir
字;6;1.0;485.0;3.0;4.0;[Character, Letter, Word, Section Of Village];[じ];[あざ, あざな, -な];4;[Letter, Character, Symbol];[じ];[];[Roof, Child];caractère, lettre
答;12;2.0;486.0;3.0;4.0;[Solution, Answer];[とう];[こた.える, こた.え];8;[Answer, Response, Reply];[とう];[こた];[Bamboo, Suit];répondre, réponse, solution
夜;8;2.0;487.0;3.0;4.0;[Night, Evening];[や];[よ, よる];6;[Night, Evening];[や];[よ, よる];[Lid, Leader, Winter, Drop];soir, nuit
製;14;5.0;488.0;2.0;1.0;[Made In..., Manufacture];[せい];[];24;[Manufacture];[せい];[];[Control, Clothes];production, fabrication
票;11;4.0;489.0;1.0;1.0;[Ballot, Label, Ticket, Sign];[ひょう];[];25;[Ballot];[ひょう];[];[Helicopter, Jackhammer];étiquette, bulletin, billet, bordereau
況;8;8.0;490.0;2.0;2.0;[Condition, Situation];[きょう];[まし.て, いわ.んや, おもむき];25;[Condition];[きょう];[];[Tsunami, Older Brother];circonstances, conjoncture, situation
音;9;1.0;491.0;3.0;4.0;[Sound, Noise];[おん, いん, -のん];[おと, ね];5;[Sound];[おん];[おと, ね];[Stand, Sun];bruit, son
申;5;3.0;492.0;2.0;3.0;[Have The Honor To, Sign Of The Monkey, 3-5pm, Ninth Sign Of Chinese Zodiac];[しん];[もう.す, もう.し-, さる];4;[Say Humbly, Say, Humbly Say];[しん];[もう];[Cross, Mouth];dire (degré plus soutenu)
様;14;3.0;493.0;2.0;3.0;[Esq., Way, Manner, Situation, Polite Suffix];[よう, しょう];[さま, さん];13;[Formal Name Title, Formal Name Ender, Manner];[よう];[さま];[Tree, Sheep, Water];manière, apparence, condition condition, M., Mme., Melle.
財;10;5.0;494.0;2.0;3.0;[Property, Money, Wealth, Assets];[ざい, さい, ぞく];[たから];19;[Wealth];[さい, ざい];[];[Shellfish, Genius];fortune, richesse, argent
港;12;3.0;495.0;2.0;3.0;[Harbor];[こう];[みなと];12;[Harbor, Port, Harbour];[こう];[みなと];[Tsunami, Together, Oneself];port
識;19;5.0;496.0;2.0;3.0;[Discriminating, Know, Write];[しき];[し.る, しる.す];17;[Discerning, Discriminating, Know];[しき];[];[Say, Sound, Drunkard];connaissance, savoir
注;8;3.0;497.0;3.0;4.0;[Pour, Irrigate, Shed (tears), Flow Into, Concentrate On, Notes, Comment, Annotate];[ちゅう];[そそ.ぐ, さ.す, つ.ぐ];11;[Pour];[ちゅう];[そそ, さ, つ];[Tsunami, Master];note, commentaire verser
呼;8;6.0;498.0;2.0;3.0;[Call, Call Out To, Invite];[こ];[よ.ぶ];23;[Call];[こ];[よ];[Mouth, Peace];appeler, convoquer, dénommer
渉;11;8.0;499.0;1.0;1.0;[Ford, Go Cross, Transit, Ferry, Import, Involve];[しょう];[わた.る];17;[Ford];[しょう];[わた];[Tsunami, Walk];traverser, être en rapport, être relié à
達;12;4.0;500.0;2.0;3.0;[Accomplished, Reach, Arrive, Attain];[たつ, だ];[-たち];18;[Attain, Plural];[たつ];[たち];[Scooter, Happiness];suffixe de pluriel atteindre, arriver
良;7;4.0;501.0;2.0;3.0;[Good, Pleasing, Skilled];[りょう];[よ.い, -よ.い, い.い, -い.い];11;[Good];[りょう];[よ, い];[Drop, Root];bon, bien, satisfaisant
響;20;8.0;502.0;1.0;1.0;[Echo, Sound, Resound, Ring, Vibrate];[きょう];[ひび.く];25;[Echo, Reverberation, Resound];[きょう];[ひび];[Poop, Root, Building, Sound];sonner, résonner, retentir
阪;7;8.0;503.0;;;[Heights, Slope];[はん];[さか];16;[Heights, Slope];[はん];[さか];[Building, Anti];pente
帰;10;2.0;504.0;3.0;4.0;[Homecoming, Arrive At, Lead To, Result In];[き];[かえ.る, かえ.す, おく.る, とつ.ぐ];15;[Return, Return Home];[き];[かえ];[Knife, Wolverine, Forehead, Towel];revenir, rentrer, retourner
針;10;6.0;505.0;2.0;2.0;[Needle, Pin, Staple, Stinger];[しん];[はり];26;[Needle];[しん];[はり];[Gold, Cross];aiguille
専;9;6.0;506.0;2.0;2.0;[Specialty, Exclusive, Mainly, Solely];[せん];[もっぱ.ら];16;[Specialty];[せん];[もっぱ];[Cross, Rice Paddy, Measurement];entièrement, exclusivement, principalement
推;11;6.0;507.0;1.0;1.0;[Conjecture, Infer, Guess, Suppose, Support, Push (for)];[すい];[お.す];34;[Infer];[すい];[お];[Fingers, Turkey];recommander, déduire
谷;7;2.0;508.0;2.0;2.0;[Valley];[こく];[たに, きわ.まる];5;[Valley];[こく];[たに];[Fins, Hat, Mouth];vallée
古;5;2.0;509.0;4.0;4.0;[Old];[こ];[ふる.い, ふる-, -ふる.す];3;[Old];[こ];[ふる];[Old];ancien, vieux
候;10;4.0;510.0;2.0;3.0;[Climate, Season, Weather, Wait For, Expect];[こう];[そうろう];25;[Climate, Weather, Candidate];[こう];[];[Leader, Stick, Hook, Arrow];saison, temps
史;5;4.0;511.0;2.0;2.0;[History, Chronicle];[し];[];19;[History];[し];[];[History];chronique, histoire
天;4;1.0;512.0;4.0;5.0;[Heavens, Sky, Imperial];[てん];[あまつ, あめ, あま-];2;[Heaven];[てん];[あま];[Heaven];voûte céleste, ciel
階;12;3.0;513.0;2.0;2.0;[Storey, Stair, Counter For Storeys Of A Building];[かい];[きざはし];12;[Floor, Story, Storey];[かい];[];[Building, Compare, White];étage, niveau
程;12;5.0;514.0;2.0;3.0;[Extent, Degree, Law, Formula, Distance, Limits, Amount];[てい];[ほど, -ほど];28;[Extent];[てい];[ほど];[Grain, Mouth, King];degré, mesure
満;12;4.0;515.0;2.0;3.0;[Full, Fullness, Enough, Satisfy];[まん, ばん];[み.ちる, み.つ, み.たす];25;[Full];[まん];[み];[Tsunami, Flowers, Both];combler, remplir
敗;11;4.0;516.0;2.0;3.0;[Failure, Defeat, Reversal];[はい];[やぶ.れる];17;[Failure, Fail];[はい];[やぶ];[Shellfish, Winter];perdre, être défait, échouer
管;14;4.0;517.0;2.0;2.0;[Pipe, Tube, Wind Instrument, Drunken Talk, Control, Jurisdiction];[かん];[くだ];24;[Pipe];[かん];[くだ];[Bamboo, Roof, Bear];tuyau, instrument à vent, officiel, administratif tuyau, conduit
値;10;6.0;518.0;2.0;3.0;[Price, Cost, Value];[ち];[ね, あたい];22;[Value, Price];[ち];[ね, あたい];[Leader, Fix];prix, valeur
歌;14;2.0;519.0;3.0;4.0;[Song, Sing];[か];[うた, うた.う];10;[Song, Sing];[か];[うた];[Lip Ring, Lack];poème, chant, chanter
買;12;2.0;520.0;4.0;4.0;[Buy];[ばい];[か.う];8;[Buy];[ばい];[か];[Net, Shellfish];acheter
突;8;8.0;521.0;2.0;3.0;[Stab, Protruding, Thrust, Pierce, Prick, Collision, Sudden];[とつ, か];[つ.く];26;[Stab, Thrust];[とつ];[つ];[Hole, Big];pousser, frapper, assaillir
兵;7;4.0;522.0;2.0;2.0;[Soldier, Private, Troops, Army, Warfare, Strategy, Tactics];[へい, ひょう];[つわもの];17;[Soldier];[へい, ひょう];[];[Axe, Ground, Fins];soldat, guerrier
接;11;5.0;523.0;2.0;2.0;[Touch, Contact, Adjoin, Piece Together];[せつ, しょう];[つ.ぐ];26;[Adjoin];[せつ];[つ];[Fingers, Stand, Woman];être en contact, toucher, recevoir
請;15;8.0;524.0;1.0;1.0;[Solicit, Invite, Ask];[せい, しん, しょう];[こ.う, う.ける];29;[Request];[せい, しん, しょう];[う, こ];[Say, Blue];demander un appui, solliciter recevoir
器;15;4.0;525.0;2.0;1.0;[Utensil, Vessel, Receptacle, Implement, Instrument, Ability, Container, Tool, Set];[き];[うつわ];13;[Container, Vessel];[き];[うつわ];[Big, Products];ustensile, outil, instrument
士;3;4.0;526.0;1.0;1.0;[Gentleman, Scholar, Samurai, Samurai Radical (no. 33)];[し];[さむらい];13;[Samurai];[し];[さむらい];[Samurai];guerrier, samuraï
光;6;2.0;527.0;3.0;3.0;[Ray, Light];[こう];[ひか.る, ひかり];5;[Sunlight, Light];[こう];[ひかり, ひか];[Triceratops, Pi];étinceler, briller, lumière, clarté, éclat
討;10;6.0;528.0;1.0;1.0;[Chastise, Attack, Defeat, Destroy, Conquer];[とう];[う.つ];26;[Chastise];[とう];[];[Say, Measurement];attaquer, châtier
路;13;3.0;529.0;2.0;3.0;[Path, Route, Road, Distance];[ろ, る];[-じ, みち];10;[Road];[ろ];[じ, みち];[Foot, Kiss];chemin, route, voie
悪;11;3.0;530.0;3.0;4.0;[Bad, Vice, Rascal, False, Evil, Wrong];[あく, お];[わる.い, わる-, あ.し, にく.い, -にく.い, ああ, いずくに, いずくんぞ, にく.む];12;[Bad, Evil];[あく, お];[わる];[Asia, Heart];méchant, mauvais, néfaste
科;9;2.0;531.0;2.0;3.0;[Department, Course, Section];[か];[];6;[Course, Science, Department];[か];[];[Grain, Ladle];section, département, branche, famille
攻;7;8.0;532.0;1.0;1.0;[Aggression, Attack, Criticize, Polish];[こう];[せ.める];28;[Aggression];[こう];[せ];[Construction, Winter];attaquer
崎;11;8.0;533.0;1.0;1.0;[Promontory, Cape, Spit];[き];[さき, さい, みさき];23;[Cape];[き];[さき];[Mountain, Big, Lip Ring];cap, pointe
督;13;8.0;534.0;1.0;1.0;[Coach, Command, Urge, Lead, Supervise];[とく];[];29;[Coach];[とく];[];[Above, Small, Stool, Eye];conduite, direction, supervision
授;11;5.0;535.0;2.0;1.0;[Impart, Instruct, Grant, Confer];[じゅ];[さず.ける, さず.かる];26;[Instruct];[じゅ];[さず];[Fingers, Accept];conférer, accorder recevoir une faveur, être gratifié
催;13;8.0;536.0;1.0;1.0;[Sponsor, Hold (a Meeting), Give (a Dinner)];[さい];[もよう.す, もよお.す];29;[Sponsor];[さい];[もよお];[Leader, Mountain, Turkey];organisation, sponsoring, promotion
細;11;2.0;537.0;2.0;2.0;[Dainty, Get Thin, Taper, Slender, Narrow, Detailed, Precise];[さい];[ほそ.い, ほそ.る, こま.か, こま.かい];17;[Thin];[さい];[ほそ, こま];[Thread, Rice Paddy];fin, étroit, ténu, s'amincir, minutieux
効;8;5.0;538.0;2.0;2.0;[Merit, Efficacy, Efficiency, Benefit];[こう];[き.く, ききめ, なら.う];25;[Effective];[こう];[き];[Mix, Power];produire de l'effet, être efficace
図;7;2.0;539.0;3.0;4.0;[Map, Drawing, Plan, Extraordinary, Audacious];[ず, と];[え, はか.る];5;[Diagram];[ず, と];[え, はか];[Mouth, Treasure, Ice];carte, plan, schéma comploter, calculer
週;11;2.0;540.0;4.0;4.0;[Week];[しゅう];[];7;[Week];[しゅう];[];[Scooter, Circumference];semaine
積;16;4.0;541.0;2.0;3.0;[Volume, Product (x*y), Acreage, Contents, Pile Up, Stack, Load, Amass];[せき];[つ.む, -づ.み, つ.もる, つ.もり];29;[Accumulate];[せき];[つ];[Grain, Blame];accumuler, amasser, charger s'accumuler, s'amasser intention
丸;3;2.0;542.0;2.0;2.0;[Round, Full (month), Perfection, -ship, Pills, Make Round, Roll Up, Curl Up, Seduce, Explain Away];[がん];[まる, まる.める, まる.い];2;[Circle, Circular, Round];[がん];[まる];[Nine, Drop];rond, circulaire, arrondir, suffixe pour les noms de bateaux
他;5;3.0;543.0;2.0;3.0;[Other, Another, The Others];[た];[ほか];4;[Other];[た];[ほか];[Leader, Alligator];autre
及;3;8.0;544.0;1.0;1.0;[Reach Out, Exert, Exercise, Cause];[きゅう];[およ.ぶ, およ.び, および, およ.ぼす];36;[Reach];[きゅう];[およ];[Escalator];atteindre, égaler, se prolonger, être capable de exercer
湾;12;8.0;545.0;2.0;2.0;[Gulf, Bay, Inlet];[わん];[いりえ];37;[Gulf];[わん];[];[Tsunami, Red, Bow];baie, golfe
録;16;4.0;546.0;2.0;2.0;[Record];[ろく];[しる.す, と.る];28;[Record];[ろく];[];[Gold, Wolverine, Water];archive, enregistrement
処;5;6.0;547.0;2.0;3.0;[Dispose, Manage, Deal With, Sentence, Condemn, Act, Behave, Place];[しょ];[ところ, -こ, お.る];28;[Deal With];[しょ];[ところ];[Winter, Table];être là, gérer, administrer, s'occuper de
省;9;4.0;548.0;2.0;2.0;[Focus, Government Ministry, Conserve];[せい, しょう];[かえり.みる, はぶ.く];21;[Conserve];[しょう, せい];[はぶ];[Few, Eye];évoquer le passé, tenir compte ministère omettre, supprimer
旧;5;5.0;549.0;2.0;2.0;[Old Times, Old Things, Old Friend, Former, Ex-];[きゅう];[ふる.い, もと];36;[Former];[きゅう];[];[Stick, Sun];ancien, d'autrefois, du passé
室;9;2.0;550.0;3.0;4.0;[Room, Apartment, Chamber, Greenhouse, Cellar];[しつ];[むろ];6;[Room];[しつ];[];[Roof, Ground, Private, Dirt];appartement, chambre, pièce
憲;16;6.0;551.0;1.0;1.0;[Constitution, Law];[けん];[];28;[Constitution];[けん];[];[Roof, Life, Net, Heart];loi, constitution
太;4;2.0;552.0;3.0;3.0;[Plump, Thick, Big Around];[たい, た];[ふと.い, ふと.る];3;[Fat];[たい, た];[ふと];[Big, Drop];gros, épais
橋;16;3.0;553.0;2.0;2.0;[Bridge];[きょう];[はし];13;[Bridge];[きょう];[はし];[Tree, Heaven, Mouth, Mustache];pont
歩;8;2.0;554.0;3.0;4.0;[Walk, Counter For Steps];[ほ, ぶ, ふ];[ある.く, あゆ.む];6;[Walk];[ほ];[ある, あゆ];[Stop, Small, Slide];marcher, marche, pas
離;19;8.0;555.0;1.0;1.0;[Detach, Separation, Disjoin, Digress];[り];[はな.れる, はな.す];31;[Detach];[り];[はな];[Rocket, Turkey];s'éloigner de, quitter, se détacher séparer, lacher
岸;8;3.0;556.0;2.0;2.0;[Beach];[がん];[きし];11;[Coast, Shore];[がん];[きし];[Mountain, Cliff, Dry];rive, rivage
客;9;3.0;557.0;2.0;3.0;[Guest, Visitor, Customer, Client];[きゃく, かく];[];9;[Guest, Customer];[きゃく];[];[Roof, Winter, Mouth];hôte, invité, visiteur
風;9;2.0;558.0;3.0;4.0;[Wind, Air, Style, Manner];[ふう, ふ];[かぜ, かざ-, -かぜ];7;[Wind, Style];[ふう, ふ];[かぜ];[Table, Slide, Insect];vent, air, manière, apparence
紙;10;2.0;559.0;3.0;4.0;[Paper];[し];[かみ];7;[Paper];[し];[かみ];[Thread, Clan];papier
激;16;6.0;560.0;1.0;1.0;[Violent, Get Excited, Enraged, Chafe, Incite];[げき];[はげ.しい];26;[Fierce, Violent];[げき];[はげ];[Tsunami, White, Direction, Winter];violent, furieux, intense
否;7;6.0;561.0;2.0;3.0;[Negate, No, Noes, Refuse, Decline, Deny];[ひ];[いな, いや];33;[No];[ひ];[いな, いや];[Not, Mouth];non, négation
周;8;4.0;562.0;2.0;2.0;[Circumference, Circuit, Lap];[しゅう];[まわ.り];14;[Circumference];[しゅう];[まわ];[Circumference];rotation, tour, environs, voisinage
師;10;5.0;563.0;2.0;3.0;[Expert, Teacher, Master, Model, Exemplar, Army (incl. Counter), War];[し];[いくさ];23;[Teacher, Expert, Master];[し];[];[Drop, Bear, Ground, Towel];maître, expert, professeur
摘;14;8.0;564.0;1.0;1.0;[Pinch, Pick, Pluck, Trim, Clip, Summarize];[てき];[つ.む];36;[Pluck];[てき];[つ];[Fingers, Mohawk];cueillir, pincer du bout des doigts
材;7;4.0;565.0;2.0;2.0;[Lumber, Log, Timber, Wood, Materials, Ingredients, Talent];[ざい];[];14;[Lumber, Material, Timber];[ざい];[];[Tree, Genius];matériaux, talent
登;12;3.0;566.0;2.0;3.0;[Ascend, Climb Up];[とう, と, どう, しょう, ちょう];[のぼ.る, あ.がる];12;[Climb];[とう, と];[のぼ];[Tent, Beans];grimper, gravir
系;7;6.0;567.0;1.0;1.0;[Lineage, System];[けい];[];30;[Lineage];[けい];[];[Lineage];système, lignée, groupe, descendance
批;7;6.0;568.0;2.0;1.0;[Criticism, Strike];[ひ];[];21;[Criticism];[ひ];[];[Fingers, Compare];critique, analyse
