kanji;strokes;grade;freq;jlpt_old;jlpt_new;meanings;readings_on;readings_kun;wk_level;wk_meanings;wk_readings_on;wk_readings_kun;wk_radicals;fr_meanings
冠;9;8.0;1503.0;1.0;1.0;[Crown, Best, Peerless];[かん];[かんむり];54;[Crown, Cap];[かん];[かんむり];[Forehead, Origin, Measurement];couronne
斜;11;8.0;1504.0;1.0;1.0;[Diagonal, Slanting, Oblique];[しゃ];[なな.め, はす];48;[Diagonal];[しゃ];[なな];[Surplus, Ladle];incliné, diagonal, oblique
銅;14;5.0;1505.0;2.0;2.0;[Copper];[どう];[あかがね];35;[Copper];[どう];[あかがね];[Gold, Same];cuivre
鏡;19;4.0;1506.0;1.0;1.0;[Mirror, Speculum, Barrel-head, Round Rice-cake Offering];[きょう, けい];[かがみ];13;[Mirror];[きょう];[かがみ];[Gold, Stand, See];miroir
浪;10;8.0;1508.0;1.0;1.0;[Wandering, Waves, Billows, Reckless, Unrestrained];[ろう];[];59;[Wander];[ろう];[];[Tsunami, Good];vague, vagabondage, errance
覧;17;6.0;1510.0;1.0;1.0;[Perusal, See];[らん];[み.る];30;[Look At];[らん];[];[Servant, Gun, Ground, See];voir, regarder
詐;12;8.0;1511.0;1.0;1.0;[Lie, Falsehood, Deceive, Pretend];[さ];[いつわ.る];47;[Lie];[さ];[いつわ];[Say, Key];mentir, faire semblant, tromper
壇;16;8.0;1512.0;1.0;1.0;[Podium, Stage, Rostrum, Terrace];[だん, たん];[];49;[Podium];[だん];[];[Dirt, Lid, Times, Dawn];plate-forme, podium, tribune, autel
勲;15;8.0;1513.0;1.0;1.0;[Meritorious Deed, Merit];[くん];[いさお];54;[Merit];[くん];[いさお];[Heavy, Power, Boil];mérite, acte exceptionnel
魔;21;8.0;1514.0;1.0;1.0;[Witch, Demon, Evil Spirit];[ま];[];46;[Devil];[ま];[];[Canopy, Tree, Demon];esprit malin, démon, diable
酬;13;8.0;1515.0;1.0;1.0;[Repay, Reward, Retribution];[しゅう, しゅ, とう];[むく.いる];54;[Repay];[しゅう, しゅ, とう];[むく];[Alcohol, Drop, River];récompense, compensation
紫;12;8.0;1516.0;1.0;1.0;[Purple, Violet];[し];[むらさき];49;[Purple];[し];[むらさき];[Stop, Spoon, Thread];violet
湿;12;8.0;1517.0;2.0;2.0;[Damp, Wet, Moist];[しつ, しゅう];[しめ.る, しめ.す, うるお.う, うるお.す];45;[Damp];[しつ];[しめ];[Tsunami, Sun, Spikes];être mouillé, être humide mouiller, humidifier
曙;17;9.0;1518.0;1.0;1.0;[Dawn, Daybreak];[しょ];[あけぼの];53;[Dawn];[しょ];[あけぼの];[Sun, Net, Someone];aurore, aube
紋;10;8.0;1519.0;1.0;1.0;[Family Crest, Figures];[もん];[];54;[Family Crest];[もん];[];[Thread, Writing];blason, armes
卸;9;8.0;1520.0;1.0;1.0;[Wholesale];[しゃ];[おろ.す, おろし, おろ.し];54;[Wholesale];[しゃ];[おろし, おろ];[Noon, Stop, Stamp];vendre en gros vente en gros
奮;16;6.0;1521.0;1.0;1.0;[Stirred Up, Be Invigorated, Flourish];[ふん];[ふる.う];50;[Stirred Up];[ふん];[ふる];[Big, Turkey, Rice Paddy];s'élancer, créer l'agitation
欄;20;8.0;1523.0;1.0;1.0;[Column, Handrail, Blank, Space];[らん];[てすり];54;[Column, Space];[らん];[てすり];[Tree, Gate, East];colonne d'un journal, balustrade
逸;11;8.0;1524.0;1.0;1.0;[Deviate, Idleness, Leisure, Miss The Mark, Evade, Elude, Parry, Diverge];[いつ];[そ.れる, そ.らす, はぐ.れる];54;[Deviate, Elude];[いつ];[そ, はぐ];[Scooter, Excuse];courir, s'écarter, être supérieur, exceller
涯;11;8.0;1525.0;1.0;1.0;[Horizon, Shore, Limit, Bound];[がい];[はて];50;[Horizon];[がい];[はて];[Tsunami, Cliff, Dirt];rivage, horizon, limite, rivage
拓;8;8.0;1526.0;1.0;1.0;[Clear (the Land), Open, Break Up (land)];[たく];[ひら.く];49;[Cultivation];[たく];[];[Fingers, Stone];développer, défricher, ouvrir
眼;11;5.0;1527.0;1.0;1.0;[Eyeball];[がん, げん];[まなこ, め];32;[Eyeball];[がん];[め];[Eye, Root];oeil, point essentiel
瓶;11;8.0;1528.0;1.0;2.0;[Bottle, Vial, Jar, Jug, Vat, Urn];[びん];[かめ];51;[Bottle];[びん];[かめ];[Horns, Lantern, Ten Thousand, Drop, Ground];bouteille, récipient
獄;14;8.0;1529.0;1.0;1.0;[Prison, Jail];[ごく];[];35;[Prison];[ごく];[];[Animal, Say, Dog];prison
尚;8;8.0;1531.0;1.0;1.0;[Esteem, Furthermore, Still, Yet];[しょう];[なお];54;[Furthermore, Esteem];[しょう];[なお];[Triceratops, Mustache];de plus, en outre, encore estime, considération
彫;11;8.0;1533.0;1.0;1.0;[Carve, Engrave, Chisel];[ちょう];[ほ.る, -ぼ.り];35;[Carve];[ちょう];[ほ];[Circumference, Hair];graver, sculpter
咲;9;8.0;1534.0;2.0;2.0;[Blossom, Bloom];[しょう];[さ.く, -ざき];48;[Blossom];[しょう];[さ];[Mouth, Horns, Heaven];fleurir, s'épanouir
穏;16;8.0;1535.0;1.0;1.0;[Calm, Quiet, Moderation];[おん];[おだ.やか];46;[Calm];[おん];[おだ];[Grain, Cleat, Wolverine, Heart];calme, doux, paisible
顕;18;8.0;1536.0;1.0;1.0;[Appear, Existing];[けん];[あきらか, あらわ.れる];54;[Appear, Exist];[けん];[あきらか, あらわ];[Sun, Spikes, Geoduck];apparaître, clair, évident, manifeste
巧;5;8.0;1537.0;1.0;1.0;[Adroit, Skilled, Ingenuity];[こう];[たく.み, たく.む, うま.い];50;[Adept];[こう];[うま, たく];[Construction, Beggar];adresse, habileté, dextérité
矛;5;8.0;1538.0;1.0;1.0;[Halberd, Arms, Festival Float];[む, ぼう];[ほこ];45;[Spear];[む];[ほこ];[Spear];hallebarde, pique, lance
垣;9;8.0;1539.0;1.0;1.0;[Hedge, Fence, Wall];[えん];[かき];43;[Hedge, Fence];[];[かき];[Dirt, Ground, Dawn];haie, clôture, mur
召;5;8.0;1540.0;2.0;2.0;[Seduce, Call, Send For, Wear, Put On, Ride In, Buy, Eat, Drink, Catch (cold)];[しょう];[め.す];51;[Call, Eat];[しょう];[め];[Call];porter, utiliser, appeler, convoquer
欺;12;8.0;1541.0;1.0;1.0;[Deceit, Cheat, Delude];[ぎ];[あざむ.く];47;[Deceit];[ぎ];[あざむ];[Crab, Lack];tromper, duper, décevoir
釣;11;8.0;1542.0;1.0;1.0;[Angling, Fish, Catch, Allure, Ensnare];[ちょう];[つ.る, つ.り, つ.り-];44;[Fishing];[ちょう];[つ];[Gold, Pool];pêcher à la ligne, leurrer
缶;6;8.0;1543.0;1.0;2.0;[Tin Can, Container, Jar Radical (no. 121)];[かん];[かま];44;[Can, Tin Can];[かん];[];[Can];boîte, bidon, récipient
粧;12;8.0;1545.0;1.0;;[Cosmetics, Adorn (ones Person)];[しょう];[];47;[Cosmetics];[しょう];[];[Rice, Canopy, Dirt];s'embellir, se parer
隻;10;8.0;1546.0;1.0;2.0;[Vessels, Counter For Ships, Fish, Birds, Arrows, One Of A Pair];[せき];[];51;[Ship Counter];[せき];[];[Turkey, Stool];pour compter les bateaux, un dans une paire
脂;10;8.0;1548.0;2.0;2.0;[Fat, Grease, Tallow, Lard, Rosin, Gum, Tar];[し];[あぶら];51;[Fat];[し];[あぶら];[Moon, Spoon, Sun];graisse animale
栗;10;9.0;1550.0;1.0;1.0;[Chestnut];[りつ, り];[くり, おののく];;[Chestnut];[りつ, り];[くり, おののく];;châtaigne
愚;13;8.0;1551.0;1.0;1.0;[Foolish, Folly, Absurdity, Stupid];[ぐ];[おろ.か];54;[Foolish];[ぐ];[おろ];[Splinter, Heart];stupide, sot, idiot
蒸;13;6.0;1552.0;2.0;2.0;[Steam, Heat, Sultry, Foment, Get Musty];[じょう, せい];[む.す, む.れる, む.らす];33;[Steam];[じょう];[む];[Flowers, Coral, Boil];dégager de la vapeur, cuire à la vapeur étuver être étuvé, faire chaud et humide
遭;14;8.0;1554.0;1.0;1.0;[Encounter, Meet, Party, Association, Interview, Join];[そう];[あ.う, あ.わせる];52;[Encounter, Meet];[そう];[あ];[Scooter, Ground, Music, Sun];rencontrer, éprouver, subir
架;9;8.0;1555.0;1.0;1.0;[Erect, Frame, Mount, Support, Shelf, Construct];[か];[か.ける, か.かる];46;[Shelf];[か];[か];[Power, Mouth, Tree];pendre, lancer (un pont), franchir
鬼;10;8.0;1557.0;1.0;1.0;[Ghost, Devil];[き];[おに, おに-];23;[Demon];[き];[おに];[Demon];démon, diable, ogre, esprit
庶;11;8.0;1558.0;1.0;1.0;[Commoner, All, Bastard];[しょ];[];54;[All, Bastard];[しょ];[];[Yurt, Boil];grand nombre, homme du peuple
肌;6;8.0;1559.0;2.0;2.0;[Texture, Skin, Body, Grain];[き];[はだ];45;[Skin];[き];[はだ];[Moon, Table];peau, tempérament, caractère, personnalité
稚;13;8.0;1560.0;1.0;1.0;[Immature, Young];[ち, じ];[いとけない, おさない, おくて, おでる];28;[Immature];[ち];[];[Grain, Turkey];jeune, infantile, immature
靴;13;8.0;1561.0;2.0;3.0;[Shoes];[か];[くつ];27;[Shoes];[か];[くつ];[Leather, Change];chaussure
幻;4;8.0;1564.0;1.0;1.0;[Phantasm, Vision, Dream, Illusion, Apparition];[げん];[まぼろし];17;[Illusion];[げん];[まぼろし];[Poop, Cape];illusion, vision
煮;12;8.0;1565.0;1.0;1.0;[Boil, Cook];[しゃ];[に.る, -に, に.える, に.やす];49;[Boil];[しゃ];[に];[Someone, Boil];bouillir, cuire faire bouillir, cuire
姫;10;8.0;1566.0;1.0;1.0;[Princess];[き];[ひめ, ひめ-];44;[Princess];[];[ひめ];[Woman, Servant];princesse
誓;14;8.0;1567.0;1.0;1.0;[Vow, Swear, Pledge];[せい];[ちか.う];49;[Vow];[せい];[ちか];[Fingers, Axe, Say];promettre, jurer, souhaiter, faire voeu
耕;10;5.0;1568.0;2.0;2.0;[Till, Plow, Cultivate];[こう];[たがや.す];51;[Plow];[こう];[たがや];[Plow, Well];labourer, cultiver
把;7;8.0;1569.0;1.0;1.0;[Grasp, Faggot, Bunch, Counter For Bundles];[は, わ];[];50;[Bundle, Grasp];[わ, は];[];[Fingers, Bed];prendre, saisir, botte, fagot, gerbe
践;13;8.0;1570.0;1.0;1.0;[Tread, Step On, Trample, Practice, Carry Through];[せん];[ふ.む];54;[Practice, Trample];[せん];[ふ];[Foot, Bar];mettre en pratique, s'élever
呈;7;8.0;1571.0;1.0;1.0;[Display, Offer, Present, Send, Exhibit];[てい];[];54;[Present, Display];[てい];[];[Mouth, King];offrir, présenter, montrer
疎;12;8.0;1572.0;1.0;1.0;[Alienate, Rough, Neglect, Shun, Sparse, Penetrate];[そ, しょ];[うと.い, うと.む, まば.ら];54;[Neglect, Sparse];[そ, しょ];[うと, まば];[Coat Rack, Bundle];éviter, dédaigner, négliger distant, étranger, froid
仰;6;8.0;1573.0;1.0;1.0;[Face-up, Look Up, Depend, Seek, Respect, Rever, Drink, Take];[ぎょう, こう];[あお.ぐ, おお.せ, お.っしゃる, おっしゃ.る];50;[Look Up To];[ぎょう, こう];[あお];[Leader, Cat Pirate];regarder vers le haut, respecter avis d'un supérieur
鈍;12;8.0;1574.0;2.0;2.0;[Dull, Slow, Foolish, Blunt];[どん];[にぶ.い, にぶ.る, にぶ-, なま.る, なまく.ら];46;[Dull];[どん];[にぶ, のろ];[Gold, Barracks];émoussé, obtus, lourd, idiot s'émousser, fléchir, s'engourdir
恥;10;8.0;1575.0;2.0;3.0;[Shame, Dishonor];[ち];[は.じる, はじ, は.じらう, は.ずかしい];35;[Shame];[ち];[は, はじ];[Ear, Heart];humiliation, honte, infamie avoir honte, être gêné honteux, embarrassé, gêné
疾;10;8.0;1577.0;1.0;1.0;[Rapidly];[しつ];[はや.い];54;[Rapidly, Rapid];[しつ];[はや];[Sick, Arrow];rapidité, maladie, souffrance
征;8;8.0;1578.0;1.0;1.0;[Subjugate, Attack The Rebellious, Collect Taxes];[せい];[];49;[Subjugate];[せい];[];[Loiter, Correct];conquérir, subjuguer, soumettre
砕;9;8.0;1579.0;1.0;1.0;[Smash, Break, Crush, Familiar, Popular];[さい];[くだ.く, くだ.ける];47;[Smash];[さい];[くだ];[Stone, Nine, Cross];se briser, être détruit, être battu briser, détruire, démolir, éclater
謡;16;8.0;1580.0;1.0;1.0;[Song, Sing, Ballad, Noh Chanting];[よう];[うた.い, うた.う];54;[Noh Chanting, Noh Chant];[よう];[うた];[Say, Satellite];chant, récitatif du No chanter
嫁;13;8.0;1581.0;1.0;1.0;[Marry Into, Bride];[か];[よめ, とつ.ぐ, い.く, ゆ.く];45;[Bride];[か];[よめ, とつ];[Woman, House];se marier belle-fille, bru, jeune mariéeépouser (du côté de la femme), rejeter une faute
謙;17;8.0;1582.0;1.0;1.0;[Self-effacing, Humble Oneself, Condescend, Be Modest];[けん];[へりくだ.る];39;[Modesty];[けん];[];[Say, Mona Lisa];modestie, humilité
后;6;6.0;1583.0;1.0;1.0;[Empress, Queen, After, Behind, Back, Later];[こう, ご];[きさき];50;[Empress];[こう, ご];[きさき];[Cliff, Ground, Mouth];impératrice, souveraine
嘆;13;8.0;1584.0;1.0;1.0;[Sigh, Lament, Moan, Grieve, Sigh Of Admiration];[たん];[なげ.く, なげ.かわしい];31;[Sigh];[たん];[なげ];[Mouth, Chinese];soupirer, se plaindre, gémir déplorable, lamentable
菌;11;8.0;1586.0;1.0;1.0;[Germ, Fungus, Bacteria];[きん];[];45;[Bacteria];[きん];[];[Flowers, Mouth, Grain];champignon, microbe, bactérie, germe
鎌;18;8.0;1587.0;1.0;1.0;[Sickle, Scythe, Trick];[れん, けん];[かま];54;[Sickle, Scythe];[けん, れん];[かま];[Gold, Mona Lisa];faucille
巣;11;4.0;1588.0;1.0;1.0;[Nest, Rookery, Hive, Cobweb, Den];[そう];[す, す.くう];31;[Nest];[そう];[す];[Grass, Fruit];nid, tanière
泥;8;8.0;1589.0;2.0;2.0;[Mud, Mire, Adhere To, Be Attached To];[でい, ない, で, に];[どろ, なず.む];31;[Mud];[でい];[どろ];[Tsunami, Flag, Spoon];boue
頻;17;8.0;1590.0;1.0;1.0;[Repeatedly, Recur];[ひん];[しき.りに];40;[Frequent];[ひん];[しき];[Walk, Geoduck];fréquemment, à plusieurs reprise
班;10;6.0;1592.0;1.0;1.0;[Squad, Corps, Unit, Group];[はん];[];48;[Squad];[はん];[];[King, Knife];équipe, groupe, clan
棚;12;8.0;1594.0;1.0;1.0;[Shelf, Ledge, Rack, Mount, Mantle, Trellis];[ほう];[たな, -だな];44;[Shelf];[ほう];[たな];[Tree, Moon];étagère
潔;15;5.0;1595.0;1.0;1.0;[Undefiled, Pure, Clean, Righteous, Gallant];[けつ];[いさぎよ.い];28;[Pure];[けつ];[いさぎよ];[Tsunami, Life, Sword, Thread];pur, innocent pur, brave, vaillant
酷;14;8.0;1596.0;1.0;1.0;[Cruel, Severe, Atrocious, Unjust];[こく];[ひど.い];54;[Cruel, Unjust];[こく];[ひど];[Alcohol, Announce];sévère, dur, cruel
廊;12;8.0;1598.0;1.0;1.0;[Corridor, Hall, Tower];[ろう];[];31;[Corridor];[ろう];[];[Canopy, Guy];galerie, couloir
寂;11;8.0;1599.0;1.0;1.0;[Loneliness, Quietly, Mellow, Mature, Death Of A Priest];[じゃく, せき];[さび, さび.しい, さび.れる, さみ.しい];56;[Lonely];[じゃく, せき];[さび, さみ];[Roof, Above, Small, Stool];triste, solitaire, désolé
隅;12;8.0;1601.0;2.0;2.0;[Corner, Nook];[ぐう];[すみ];51;[Corner];[ぐう];[すみ];[Building, Splinter];coin, recoin
偶;11;8.0;1602.0;2.0;3.0;[Accidentally, Even Number, Couple, Man & Wife, Same Kind];[ぐう];[たま];50;[Accidentally];[ぐう];[たま];[Leader, Splinter];par hasard, accorder, nombre pair
霞;17;9.0;1603.0;1.0;1.0;[Be Hazy, Grow Dim, Blurred];[か, げ];[かすみ, かす.む];;[Be Hazy, Grow Dim, Blurred];[か, げ];[かすみ, かす.む];;être brumeux, s'assombrir, devenir flou
伏;6;8.0;1604.0;1.0;1.0;[Prostrated, Bend Down, Bow, Cover, Lay (pipes)];[ふく];[ふ.せる, ふ.す];55;[Bow, Lay];[ふく];[ふ];[Leader, Dog];se cacher, se baisser se coucher à terre, baisser les yeux
灯;6;4.0;1605.0;2.0;2.0;[Lamp, A Light, Light, Counter For Lights];[とう];[ひ, ほ-, ともしび, とも.す, あかり];48;[Lamp];[とう];[あかり, とも];[Fire, Street];lumière électrique, lampe
辛;7;8.0;1607.0;2.0;2.0;[Spicy, Bitter, Hot, Acrid];[しん];[から.い, つら.い, -づら.い, かのと];44;[Spicy];[しん];[から, つら];[Spicy];piquant, épicé, salé, amer pénible, âpre
磨;16;8.0;1608.0;2.0;2.0;[Grind, Polish, Scour, Improve, Brush (teeth)];[ま];[みが.く, す.る];45;[Polish];[ま];[みが];[Canopy, Tree, Stone];polir, poncer, brosser, cirer
碁;13;8.0;1609.0;1.0;1.0;[Go];[ご];[];46;[Go];[ご];[];[Crab, Stone];jeu de go
俗;9;8.0;1610.0;1.0;1.0;[Vulgar, Customs, Manners, Worldliness, Mundane Things];[ぞく];[];49;[Vulgar];[ぞく];[];[Leader, Valley];coutume, tradition, habitude, banal
漠;13;8.0;1611.0;1.0;1.0;[Vague, Obscure, Desert, Wide];[ばく];[];33;[Desert, Vague];[ばく];[];[Tsunami, Greenhouse];vague, désert, large
邪;8;8.0;1612.0;1.0;1.0;[Wicked, Injustice, Wrong];[じゃ];[よこし.ま];50;[Wicked];[じゃ];[よこし];[Fang, Building];mal, injustice, méchanceté, perversité
晶;12;8.0;1613.0;1.0;1.0;[Sparkle, Clear, Crystal];[しょう];[];50;[Crystal];[しょう];[];[Sun];cristal, clarté
辻;5;9.0;1614.0;;;[Crossing, Crossroad, Street Corners, (kokuji)];[];[つじ];;[Crossing, Crossroad, Street Corners, (kokuji)];[];[つじ];;carrefour, croisement
麦;7;2.0;1615.0;2.0;2.0;[Barley, Wheat];[ばく];[むぎ];5;[Wheat];[ばく];[むぎ];[Life, Winter];céréales, blé, orge, avoine, seigle
墨;14;8.0;1616.0;1.0;1.0;[Black Ink, India Ink, Ink Stick, Mexico];[ぼく];[すみ];46;[Black Ink, Ink];[];[すみ];[Black, Dirt];encre de Chine
鎮;18;8.0;1617.0;1.0;1.0;[Tranquilize, Ancient Peace-preservation Centers];[ちん];[しず.める, しず.まる, おさえ];55;[Tranquilize];[ちん];[おさえ, しず];[Gold, Reality];calmer, apaiser s'apaiser
洞;9;8.0;1618.0;1.0;1.0;[Den, Cave, Excavation];[どう];[ほら];50;[Cave];[どう];[ほら];[Tsunami, Same];grotte, caverne
履;15;8.0;1619.0;1.0;1.0;[Perform, Complete, Footgear, Shoes, Boots, Put On (the Feet)];[り];[は.く];19;[Boots];[り];[は];[Flag, Loiter, Black Hole];porter (des chaussures), aller, exécuter
劣;6;8.0;1620.0;1.0;1.0;[Inferiority, Be Inferior To, Be Worse];[れつ];[おと.る];49;[Inferiority];[れつ];[おと];[Few, Power];être inférieur
那;7;8.0;1621.0;1.0;1.0;[What?];[な, だ];[なに, なんぞ, いかん];55;[What];[な, だ];[いかん, なに, なんぞ];[Sword, Two, Building];quelle personne ?
殴;8;8.0;1622.0;1.0;1.0;[Assault, Hit, Beat, Thrash];[おう];[なぐ.る];48;[Assault];[おう];[なぐ];[District, Weapon];donner des coups, battre
娠;10;8.0;1623.0;1.0;1.0;[With Child, Pregnancy];[しん];[];38;[Pregnant];[しん];[];[Woman, Landslide];grossesse
奉;8;8.0;1624.0;1.0;1.0;[Observance, Offer, Present, Dedicate];[ほう, ぶ];[たてまつ.る, まつ.る, ほう.ずる];55;[Dedicate];[ほう, ぶ];[たてまつ, まつ, ほう];[Spring, Dry];offrir avec respect croire en, obéir
憂;15;8.0;1625.0;1.0;1.0;[Melancholy, Grieve, Lament, Be Anxious, Sad, Unhappy];[ゆう];[うれ.える, うれ.い, う.い, う.き];55;[Grief];[ゆう];[う, うれ];[Hundred, Forehead, Heart, Winter];être désolé, être anxieux, se faire du souci détresse, douleur, souci triste, soucieux, déprimé, anxieux
朴;6;8.0;1626.0;1.0;1.0;[Crude, Simple, Plain, Docile];[ぼく];[ほう, ほお, えのき];55;[Simple, Crude];[ぼく];[えのき, ほう, ほお];[Tree, Toe];simple, naïf, peu sociable
亭;9;8.0;1627.0;1.0;1.0;[Pavilion, Restaurant, Mansion, Arbor, Cottage, Vaudeville, Music Hall, Stage Name];[てい, ちん];[];50;[Restaurant];[てい];[];[Restaurant];pavillon, restaurant
姓;8;8.0;1628.0;2.0;2.0;[Surname];[せい, しょう];[];36;[Surname, Family Name];[せい, しょう];[];[Woman, Life];nom de famille
筒;12;8.0;1631.0;2.0;2.0;[Cylinder, Pipe, Tube, Gun Barrel, Sleeve];[とう];[つつ];43;[Cylinder];[とう];[つつ];[Bamboo, Same];tube, tuyau
鼻;14;3.0;1632.0;2.0;2.0;[Nose, Snout];[び];[はな];17;[Nose];[び];[はな];[Self, Rice Paddy, Twenty];nez
怪;8;8.0;1634.0;1.0;1.0;[Suspicious, Mystery, Apparition];[かい, け];[あや.しい, あや.しむ];26;[Suspicious];[かい, け];[あや];[Soul, Tombstone];apparition, mystère douteux, suspect douter, suspecter, s'étonner
粒;11;8.0;1635.0;2.0;2.0;[Grains, Drop, Counter For Tiny Particles];[りゅう];[つぶ];44;[Grains];[りゅう];[つぶ];[Rice, Stand];grain, particule, compteur pour les particules
詞;12;6.0;1636.0;2.0;2.0;[Part Of Speech, Words, Poetry];[し];[ことば];19;[Part Of Speech, Speech Particle, Particle Of Speech, Grammar Particle];[し];[];[Say, Director];mot, terme
鳩;13;9.0;1637.0;1.0;1.0;[Pigeon, Dove];[きゅう, く];[はと, あつ.める];46;[Dove, Pigeon];[く];[はと];[Nine, Bird];colombe, pigeon
偉;12;8.0;1639.0;2.0;3.0;[Admirable, Greatness, Remarkable, Conceited, Famous, Excellent];[い];[えら.い];51;[Greatness];[い];[えら];[Leader, Korea];éminent, illustre, important, distingué
酔;11;8.0;1640.0;1.0;1.0;[Drunk, Feel Sick, Poisoned, Elated, Spellbound];[すい];[よ.う, よ.い, よ];35;[Drunk];[すい];[よ];[Alcohol, Nine, Cross];ivre
惜;11;8.0;1641.0;1.0;1.0;[Pity, Be Sparing Of, Frugal, Stingy, Regret];[せき];[お.しい, お.しむ];55;[Frugal];[せき];[お];[Soul, Long Ago];regrettable, précieux regretter, apprécier, ménager, épargner
穫;18;8.0;1642.0;1.0;1.0;[Harvest, Reap];[かく];[];48;[Harvest];[かく];[];[Grain, Flowers, Turkey, Stool];récolter, obtenir
潤;15;8.0;1644.0;1.0;1.0;[Wet, Be Watered, Profit By, Receive Benefits, Favor, Charm, Steep];[じゅん];[うるお.う, うるお.す, うる.む];49;[Watered];[じゅん];[うるお, うる];[Tsunami, Gate, King];arroser, humecter, enrichir se mouiller, s'humecter s'humidifier, devenir terne
悼;11;8.0;1645.0;1.0;1.0;[Lament, Grieve Over];[とう];[いた.む];55;[Grieve, Mourn];[とう];[いた];[Soul, Toe, Early];déplorer, pleurer, se lamenter
乏;4;8.0;1646.0;1.0;1.0;[Destitution, Scarce, Limited];[ぼう];[とぼ.しい, とも.しい];30;[Scarce];[ぼう];[とぼ];[Leaf, Hills];insuffisant, pauvre, rare, peu abondant
胃;9;4.0;1647.0;2.0;2.0;[Stomach, Paunch, Crop, Craw];[い];[];27;[Stomach];[い];[];[Rice Paddy, Moon];estomac
髄;19;8.0;1652.0;1.0;1.0;[Marrow, Pith, Essence];[ずい];[];55;[Marrow, Bone Marrow];[ずい];[];[Bone, Have, Scooter];moelle
虎;8;8.0;1653.0;1.0;1.0;[Tiger, Drunkard];[こ];[とら];41;[Tiger];[こ];[とら];[Tiger, Legs];tigre
盆;9;8.0;1654.0;1.0;1.0;[Basin, Lantern Festival, Tray];[ぼん];[];46;[Lantern Festival];[ぼん];[];[Part, Plate];plateau, fête des morts
穂;15;8.0;1656.0;1.0;1.0;[Ear, Ear (grain), Head, Crest (wave)];[すい];[ほ];46;[Head of Plant, Ear Of Plant];[すい];[ほ];[Grain, Favor];épi, pointe
壮;6;8.0;1657.0;1.0;1.0;[Robust, Manhood, Prosperity];[そう];[さかん];50;[Robust];[そう];[];[Icicle, Samurai];actif, mature, fort, puissant
堤;12;8.0;1658.0;1.0;1.0;[Dike, Bank, Embankment];[てい];[つつみ];50;[Embankment];[てい];[つつみ];[Dirt, Sun, Correct];digue, berge
飢;10;8.0;1659.0;1.0;1.0;[Hungry, Starve];[き];[う.える];48;[Starve];[き];[う];[Eat, Table];souffrir de la faim, famine
傍;12;8.0;1660.0;1.0;1.0;[Bystander, Side, Besides, While, Nearby, Third Person];[ぼう];[かたわ.ら, わき, おか-, はた, そば];55;[Nearby, Side];[ぼう];[かたわ, わき, おか, はた, そば];[Leader, Stand, Direction];de côté, en faisant autre chose
疫;9;8.0;1661.0;1.0;1.0;[Epidemic];[えき, やく];[];50;[Epidemic];[えき];[];[Sick, Weapon];épidémie
累;11;8.0;1662.0;1.0;1.0;[Accumulate, Involvement, Trouble, Tie Up, Continually];[るい];[];55;[Accumulate];[るい];[];[Rice Paddy, Thread];implication, lien, accumulation
痴;13;8.0;1663.0;1.0;1.0;[Stupid, Foolish];[ち];[し.れる, おろか];54;[Stupid];[ち];[おろか, し];[Sick, Arrow, Mouth];idiot, stupide
畳;12;8.0;1665.0;2.0;2.0;[Tatami Mat, Counter For Tatami Mats, Fold, Shut Up, Do Away With];[じょう, ちょう];[たた.む, たたみ, かさ.なる];47;[Tatami Mat];[じょう];[たたみ];[Rice Paddy, Forehead, Top Hat];replier, rouler tatami, natte de paille pour compter les tatami
癒;18;8.0;1667.0;1.0;1.0;[Healing, Cure, Quench (thirst), Wreak];[ゆ];[い.える, いや.す, い.やす];55;[Healing, Cure];[ゆ];[い, いや];[Sick, Death Star, Heart];soigner
寸;3;6.0;1669.0;1.0;1.0;[Measurement, Tenth Of A Shaku, A Little, Small];[すん];[];44;[Measurement];[すん];[];[Measurement];unité de longueur d'environ 3 cm
郭;11;8.0;1670.0;1.0;1.0;[Enclosure, Quarters, Fortification, Red-light District];[かく];[くるわ];55;[Enclosure];[かく];[くるわ];[Sock, Building];pourtour, enceinte, périmètre
机;6;6.0;1671.0;2.0;2.0;[Desk, Table];[き];[つくえ];32;[Desk];[き];[つくえ];[Tree, Table];table, bureau
尿;7;8.0;1672.0;1.0;1.0;[Urine];[にょう];[ゆばり, いばり, しと];55;[Urine, Pee];[にょう];[];[Flag, Water];urine
凶;4;8.0;1673.0;1.0;1.0;[Villain, Evil, Bad Luck, Disaster];[きょう];[];45;[Villain];[きょう];[];[Treasure Chest];malheur, désastre, mauvais sort
吐;6;8.0;1674.0;1.0;1.0;[Spit, Vomit, Belch, Confess, Tell (lies)];[と];[は.く, つ.く];34;[Throw Up, Spit, Vomit];[と];[は];[Mouth, Dirt];cracher, vomir, avouer, exhaler
宴;10;8.0;1675.0;1.0;1.0;[Banquet, Feast, Party];[えん];[うたげ];29;[Banquet];[えん];[うたげ];[Roof, Sun, Woman];fête, banquet
鷹;24;9.0;1676.0;1.0;1.0;[Hawk];[よう, おう];[たか];;[Hawk];[よう, おう];[たか];;faucon
虜;13;8.0;1678.0;1.0;1.0;[Captive, Barbarian, Low Epithet For The Enemy];[りょ, ろ];[とりこ, とりく];55;[Captive];[りょ, ろ];[とりく, とりこ];[Tiger, Man];captif, prisonnier
膚;15;8.0;1679.0;2.0;2.0;[Skin, Body, Grain, Texture, Disposition];[ふ];[はだ];51;[Skin];[ふ];[はだ];[Tiger, Stomach];peau, tempérament, caractère
陶;11;8.0;1680.0;1.0;1.0;[Pottery, Porcelain];[とう];[すえ];49;[Pottery];[とう];[];[Building, Prison, Can];porcelaine, poterie
鐘;20;8.0;1681.0;1.0;1.0;[Bell, Gong, Chimes];[しょう];[かね];45;[Bell];[しょう];[かね];[Gold, Stand, Village];cloche, carillon
憾;16;8.0;1682.0;1.0;1.0;[Remorse, Regret, Be Sorry];[かん];[うら.む];55;[Remorse, Regret];[かん];[うら];[Soul, Feeling];regrets, remords
猪;11;9.0;1684.0;1.0;1.0;[Boar];[ちょ];[い, いのしし];;[Boar];[ちょ];[い, いのしし];;sanglier
磁;14;6.0;1686.0;1.0;1.0;[Magnet, Porcelain];[じ];[];34;[Magnet];[じ];[];[Stone, Horns, Ground, Poop];magnétisme, aimant, porcelaine
昆;8;8.0;1688.0;1.0;1.0;[Descendants, Elder Brother, Insect];[こん];[];19;[Descendants];[こん];[];[Sun, Compare];insecte, frère ainé
粗;11;8.0;1689.0;1.0;1.0;[Coarse, Rough, Rugged];[そ];[あら.い, あら-];55;[Coarse, Rough];[そ];[あら];[Rice, Top Hat];rugueux, grossier
訂;9;8.0;1690.0;1.0;1.0;[Revise, Correct, Decide];[てい];[ただ.す];50;[Revise];[てい];[];[Say, Street];correction, révision
芽;8;4.0;1691.0;1.0;1.0;[Bud, Sprout, Spear, Germ];[が];[め];44;[Sprout];[が];[め];[Flowers, Fang];pousse, bourgeon, germe
尻;5;8.0;1692.0;;;[Buttocks, Hips, Butt, Rear];[こう];[しり];20;[Butt];[];[しり];[Flag, Nine];fesse, postérieur
傘;12;8.0;1694.0;1.0;1.0;[Umbrella];[さん];[かさ];28;[Umbrella];[さん];[かさ];[Hat, Person, Cross];parapluie, parasol
