kanji;strokes;grade;freq;jlpt_old;jlpt_new;meanings;readings_on;readings_kun;wk_level;wk_meanings;wk_readings_on;wk_readings_kun;wk_radicals;fr_meanings
更;7;8.0;861.0;2.0;3.0;[Grow Late, Night Watch, Sit Up Late, Of Course, Renew, Renovate, Again, More And More, Further];[こう];[さら, さら.に, ふ.ける, ふ.かす];30;[Again, Renew];[こう];[さら, ふ];[Ground, Rice Paddy, Treasure];de nouveau, de plus être tard, être avancé dans la nuit
秘;10;6.0;862.0;1.0;1.0;[Secret, Conceal];[ひ];[ひ.める, ひそ.か, かく.す];32;[Secret];[ひ];[ひ];[Grain, Certain];tenir secret
拒;8;8.0;863.0;1.0;1.0;[Repel, Refuse, Reject, Decline];[きょ, ご];[こば.む];39;[Refuse, Refusal];[きょ];[こば];[Fingers, Giant];résister, refuser, s'opposer à
刑;6;8.0;864.0;1.0;1.0;[Punish, Penalty, Sentence, Punishment];[けい];[];37;[Punish];[けい];[];[Lantern, Knife];punition, peine, sanction, châtiment
坂;7;3.0;865.0;2.0;2.0;[Slope, Incline, Hill];[はん];[さか];15;[Slope];[はん];[さか];[Dirt, Anti];pente, colline
刻;8;6.0;866.0;2.0;3.0;[Engrave, Cut Fine, Chop, Hash, Mince, Time, Carving];[こく];[きざ.む, きざ.み];34;[Carve];[こく];[きざ];[Slice, Knife];hacher, couper en morceau, ciseler, diviser, graver heure
底;8;4.0;867.0;2.0;2.0;[Bottom, Sole, Depth, Bottom Price, Base, Kind, Sort];[てい];[そこ];17;[Bottom];[てい];[そこ];[Canopy, Clan, Ground];fond
賛;15;5.0;868.0;2.0;3.0;[Approve, Praise, Title Or Inscription On Picture, Assist, Agree With];[さん];[たす.ける, たた.える];32;[Agree];[さん];[];[Husband, Shellfish];louange, approbation
塚;12;8.0;869.0;1.0;1.0;[Hillock, Mound];[ちょう];[つか, -づか];51;[Mound];[ちょう];[つか];[Dirt, Forehead, Pig];tas, tertre, monticule
致;10;8.0;870.0;1.0;1.0;[Doth, Do, Send, Forward, Cause, Exert, Incur, Engage];[ち];[いた.す];38;[Do];[ち];[いた];[Mole, Winter];faire, causer, provoquer
抱;8;8.0;871.0;2.0;3.0;[Embrace, Hug, Hold In Arms];[ほう];[だ.く, いだ.く, かか.える];37;[Hug];[ほう];[だ, かか, いだ];[Fingers, Wrap];embrasser, tenir dans ses bras avoir à charge, engager, employer
繰;19;8.0;872.0;1.0;1.0;[Winding, Reel, Spin, Turn (pages), Look Up, Refer To];[そう];[く.る];38;[Spin];[そう];[く];[Thread, Syrup];tourner des pages, enrouler sur une bobine
服;8;3.0;873.0;3.0;4.0;[Clothing, Admit, Obey, Discharge];[ふく];[];9;[Clothes, Clothing];[ふく];[];[Moon, Stamp, Stool];vêtement obéir, acquiescer
犯;5;5.0;874.0;2.0;3.0;[Crime, Sin, Offense];[はん, ぼん];[おか.す];20;[Crime];[はん];[おか];[Animal, Snake];enfeindre, commettre, braver, violer
尾;7;8.0;875.0;1.0;1.0;[Tail, End, Counter For Fish, Lower Slope Of Mountain];[び];[お];20;[Tail];[び];[お, ぽ];[Flag, Fur];queue
描;11;8.0;876.0;1.0;1.0;[Sketch, Compose, Write, Draw, Paint];[びょう];[えが.く, か.く];38;[Draw];[びょう];[か, えが];[Fingers, Flowers, Rice Paddy];peindre, dessiner, décrire
布;5;5.0;877.0;2.0;2.0;[Linen, Cloth, Spread, Distribute];[ふ];[ぬの];19;[Cloth];[ふ];[ぬの];[Narwhal, Towel];étendre tissu, étoffe
恐;10;8.0;878.0;2.0;3.0;[Fear, Dread, Awe];[きょう];[おそ.れる, おそ.る, おそ.ろしい, こわ.い, こわ.がる];29;[Fear];[きょう];[おそ, こわ];[Saw, Heart];avoir peur, craindre, redouter redoutable, terrible
寺;6;2.0;879.0;2.0;2.0;[Buddhist Temple];[じ];[てら];15;[Temple];[じ];[てら];[Temple];temple, monastère bouddhique
鈴;13;8.0;880.0;1.0;1.0;[Small Bell, Buzzer];[れい, りん];[すず];39;[Buzzer, Small Bell];[りん];[すず];[Gold, Orders];clochette, grelot
盤;15;8.0;881.0;1.0;1.0;[Tray, Shallow Bowl, Platter, Tub, Board, Phonograph Record];[ばん];[];38;[Tray, Platter, Board];[ばん];[];[Boat, Weapon, Plate];disque, plateau, bassin
息;10;3.0;882.0;2.0;3.0;[Breath, Respiration, Son, Interest (on Money)];[そく];[いき];12;[Breath];[そく];[いき];[Self, Heart];souffle, respiration
宇;6;6.0;883.0;2.0;2.0;[Eaves, Roof, House, Heaven];[う];[];19;[Outer Space];[う];[];[Roof, Dry];toit, ciel
項;12;8.0;884.0;1.0;1.0;[Paragraph, Nape Of Neck, Clause, Item, Term (expression)];[こう];[うなじ];39;[Paragraph];[こう];[];[Construction, Geoduck];rubrique, clause, article, paragraphe
喪;12;8.0;885.0;1.0;1.0;[Miss, Mourning];[そう];[も];42;[Mourning];[そう];[も];[Cross, Mouth, Clothes];deuil, perte
伴;7;8.0;886.0;1.0;1.0;[Consort, Accompany, Bring With, Companion];[はん, ばん];[ともな.う];38;[Accompany];[はん];[ともな];[Leader, Half];aller avec, accompagner, comporter
遠;13;2.0;887.0;3.0;3.0;[Distant, Far];[えん, おん];[とお.い];16;[Far];[えん];[とお];[Scooter, Zombie];éloigné, lointain, distant
養;15;4.0;888.0;1.0;1.0;[Foster, Bring Up, Rear, Develop, Nurture];[よう, りょう];[やしな.う];13;[Foster];[よう];[やしな];[Sheep, Good, Fins];nourrir, élever, entretenir
懸;20;8.0;889.0;1.0;1.0;[State Of Suspension, Hang, Depend, Consult, Distant, Far Apart];[けん, け];[か.ける, か.かる];38;[Suspend];[けん];[か];[Prefecture, Lineage, Heart];suspendu, accroché suspendre, accrocher
戻;7;8.0;890.0;2.0;3.0;[Re-, Return, Revert, Resume, Restore, Go Backwards];[れい];[もど.す, もど.る];37;[Return];[れい];[もど];[Door, Big];revenir sur ses pas, rétablir
街;12;4.0;891.0;1.0;1.0;[Boulevard, Street, Town];[がい, かい];[まち];29;[Street];[がい, かい];[まち];[Dirt, Go];rue, avenue, quartier
巨;5;8.0;892.0;2.0;2.0;[Gigantic, Big, Large, Great];[きょ];[];28;[Giant];[きょ];[];[Giant];énorme, immense, gigantesque
震;15;8.0;893.0;2.0;2.0;[Quake, Shake, Tremble, Quiver, Shiver];[しん];[ふる.う, ふる.える];20;[Earthquake, Quake, Shake];[しん];[ふる];[Rain, Landslide];secouer, trembler, frissonner
願;19;4.0;894.0;2.0;3.0;[Petition, Request, Vow, Wish, Hope];[がん];[ねが.う, -ねがい];13;[Request];[がん];[ねが, ねがい];[Original, Geoduck];demander, prier, désirer demande, prière, requête
絵;12;2.0;895.0;2.0;3.0;[Picture, Drawing, Painting, Sketch];[かい, え];[];8;[Drawing, Painting];[え];[];[Thread, Meet];dessin, peinture
希;7;4.0;896.0;2.0;2.0;[Hope, Beg, Request, Pray, Beseech, Greece, Dilute (acid), Rare, Few, Phenomenal];[き, け];[まれ];14;[Wish];[き];[まれ];[Treasure, Narwhal, Towel];souhait, désir, rare
越;12;8.0;897.0;2.0;3.0;[Surpass, Cross Over, Move To, Exceed, Vietnam];[えつ, おつ];[こ.す, -こ.す, -ご.し, こ.える, -ご.え];30;[Go Beyond];[えつ];[こ];[Run, Become];dépasser, franchir, aller au-delà de
契;9;8.0;898.0;1.0;1.0;[Pledge, Promise, Vow];[けい];[ちぎ.る];37;[Pledge];[けい];[];[Life, Sword, Big];promettre, contracter, s'unir
掲;11;8.0;899.0;1.0;1.0;[Put Up (a Notice), Put Up, Hoist, Display, Hang Out, Publish, Describe];[けい];[かか.げる];37;[Display];[けい];[かか];[Fingers, Sun, Prison, Spoon];hisser, publier, afficher
躍;21;8.0;900.0;1.0;1.0;[Leap, Dance, Skip];[やく];[おど.る];39;[Leap];[やく];[おど];[Foot, Wolverine, Turkey];sauter, bondir
棄;13;8.0;901.0;1.0;1.0;[Abandon, Throw Away, Discard, Resign, Reject, Sacrifice];[き];[す.てる];41;[Abandon];[き];[];[Trash, Fruit];abandonner, renoncer
欲;11;6.0;902.0;2.0;3.0;[Longing, Covetousness, Greed, Passion, Desire, Craving];[よく];[ほっ.する, ほ.しい];32;[Want];[よく];[ほ];[Valley, Lack];désir, convoitise désirer, vouloir désiré, voulu
痛;12;6.0;903.0;2.0;3.0;[Pain, Hurt, Damage, Bruise];[つう];[いた.い, いた.む, いた.ましい, いた.める];27;[Pain];[つう];[いた];[Sick, Mama, Task];douloureux douleur, souffrance avoir mal, souffrir
触;13;8.0;904.0;2.0;2.0;[Contact, Touch, Feel, Hit, Proclaim, Announce, Conflict];[しょく];[ふ.れる, さわ.る, さわ];24;[Touch];[しょく];[さわ, ふ];[Angle, Insect];toucher, entrer en contact
邸;8;8.0;905.0;1.0;1.0;[Residence, Mansion];[てい];[やしき];51;[Residence];[てい];[やしき];[Clan, Ground, Building];demeure, résidence
依;8;8.0;906.0;2.0;2.0;[Reliant, Depend On, Consequently, Therefore, Due To];[い, え];[よ.る];36;[Reliant, Dependent];[い];[よ];[Leader, Clothes];dépendance, confiance
籍;20;8.0;907.0;1.0;2.0;[Enroll, Domiciliary Register, Membership];[せき];[];43;[Enroll];[せき];[];[Bamboo, Plow, Long Ago];immatriculation, registre
汚;6;8.0;908.0;2.0;2.0;[Dirty, Pollute, Disgrace, Rape, Defile];[お];[けが.す, けが.れる, けが.らわしい, よご.す, よご.れる, きたな.い];32;[Dirty];[お];[よご, きたな, けが];[Tsunami, Ground, Beggar];souillé, sale, impur se salir rendre impur, être impur
縮;17;6.0;909.0;1.0;1.0;[Shrink, Contract, Shrivel, Wrinkle, Reduce];[しゅく];[ちぢ.む, ちぢ.まる, ちぢ.める, ちぢ.れる, ちぢ.らす];34;[Shrink];[しゅく];[ちぢ, ちじ];[Thread, Roof, Leader, Hundred];se contracter, rétrécir diminuer, réduire, écourter
還;16;8.0;910.0;1.0;1.0;[Send Back, Return];[かん];[かえ.る];38;[Send Back];[かん];[かえ];[Scooter, Net, Zombie];retourner, revenir, rendre
枚;8;6.0;911.0;2.0;2.0;[Sheet Of..., Counter For Flat Thin Objects Or Sheets];[まい, ばい];[];18;[Flat Objects Counter, Flat Object, Counter For Flat Objects];[まい];[];[Tree, Winter];pour compter des objets plats ou minces
属;12;5.0;912.0;1.0;1.0;[Belong, Genus, Subordinate Official, Affiliated];[ぞく, しょく];[さかん, つく, やから];25;[Belong];[ぞく];[];[Flag, Mantis];appartenir à
笑;10;4.0;913.0;2.0;3.0;[Laugh];[しょう];[わら.う, え.む];16;[Laugh];[しょう];[わら, え];[Bamboo, Heaven];rire
互;4;8.0;914.0;2.0;3.0;[Mutually, Reciprocally, Together];[ご];[たが.い, かたみ.に];35;[Mutual];[ご];[たが];[Ground, Shuriken];mutuel, réciproque
複;14;5.0;915.0;2.0;2.0;[Duplicate, Double, Compound, Multiple];[ふく];[];32;[Duplicate];[ふく];[];[Spirit, Black Hole];double, multiple, répétitif, composé
慮;15;8.0;916.0;1.0;1.0;[Prudence, Thought, Concern, Consider, Deliberate, Fear];[りょ];[おもんぱく.る, おもんぱか.る];38;[Consider];[りょ];[おもんぱく, おもんぱか];[Tiger, Think];pensée, considération
郵;11;6.0;917.0;2.0;2.0;[Mail, Stagecoach Stop];[ゆう];[];26;[Mail];[ゆう];[];[Car, Building];poste, collecte et distribution
束;7;4.0;918.0;2.0;3.0;[Bundle, Sheaf, Ream, Tie In Bundles, Govern, Manage, Control];[そく];[たば, たば.ねる, つか, つか.ねる];14;[Bundle];[そく];[たば];[Bundle];faisceau, laisse, rame de papier
仲;6;4.0;919.0;2.0;2.0;[Go-between, Relationship];[ちゅう];[なか];11;[Relationship];[ちゅう];[なか];[Leader, Middle];rapports, relation
栄;9;4.0;920.0;2.0;2.0;[Flourish, Prosperity, Honor, Glory, Splendor];[えい, よう];[さか.える, は.え, -ば.え, は.える, え];17;[Prosper, Flourish];[えい];[さか];[Viking, Tree];gloire, splendeur briller prospérer
札;5;4.0;921.0;2.0;2.0;[Tag, Paper Money, Counter For Bonds, Placard, Bid];[さつ];[ふだ];7;[Bill, Tag, Label, Note];[さつ];[ふだ];[Tree, Umbrella];pour compter les billet, les tickets étiquette, carte, talisman
枠;8;8.0;922.0;1.0;1.0;[Frame, Framework, Spindle, Spool, Bounding-box, (kokuji)];[];[わく];39;[Frame];[];[わく];[Tree, Nine, Cross];cadre, structure, monture, chassis
似;7;5.0;923.0;2.0;3.0;[Becoming, Resemble, Counterfeit, Imitate, Suitable];[じ];[に.る, ひ.る];31;[Resemble];[ね, じ];[に];[Leader, Lion, Drop, Person];ressembler à
夕;3;1.0;924.0;3.0;4.0;[Evening];[せき];[ゆう];2;[Evening];[せき];[ゆう];[Evening];soir, soirée
恵;10;8.0;925.0;2.0;1.0;[Favor, Blessing, Grace, Kindness];[けい, え];[めぐ.む, めぐ.み];37;[Favor];[え, けい];[めぐ];[Cross, Rice Paddy, Heart];rendre service, faire la charité, bénir, secourir
板;8;3.0;926.0;2.0;2.0;[Plank, Board, Plate, Stage];[はん, ばん];[いた];29;[Board];[はん];[いた];[Tree, Anti];planche, panneau
列;6;3.0;927.0;2.0;3.0;[File, Row, Rank, Tier, Column];[れつ, れ];[];15;[Row];[れつ];[];[Yakuza, Knife];rang, file, queue
露;21;8.0;928.0;1.0;1.0;[Dew, Tears, Expose, Russia];[ろ, ろう];[つゆ];43;[Expose, Dew];[ろ, ろう];[つゆ];[Rain, Foot, Kiss];exposé rosée
沖;7;8.0;929.0;1.0;1.0;[Open Sea, Offing, Rise High Into Sky];[ちゅう];[おき, おきつ, ちゅう.する, わく];36;[Open Sea];[ちゅう];[おき];[Tsunami, Middle];pleine mer, large
探;11;6.0;930.0;2.0;3.0;[Grope, Search, Look For];[たん];[さぐ.る, さが.す];31;[Look For, Search For];[たん];[さが, さぐ];[Fingers, Pi, Tree];chercher, sonder, espionner
逃;9;8.0;931.0;2.0;3.0;[Escape, Flee, Shirk, Evade, Set Free];[とう];[に.げる, に.がす, のが.す, のが.れる];38;[Escape];[とう];[に, のが, の];[Scooter, Omen];fuir, s'échapper éviter, échapper à
借;10;4.0;932.0;3.0;4.0;[Borrow, Rent];[しゃく];[か.りる];18;[Borrow];[しゃく];[か];[Leader, Long Ago];emprunter, louer
緩;15;8.0;933.0;1.0;1.0;[Slacken, Loosen, Relax, Lessen, Be Moderate, Ease];[かん];[ゆる.い, ゆる.やか, ゆる.む, ゆる.める];38;[Loose];[かん];[ゆる];[Thread, Football];se relâcher, se détendre relâcher, détendre relaché, lâche
節;13;4.0;934.0;2.0;1.0;[Node, Season, Period, Occasion, Verse, Clause, Stanza, Honor, Joint, Knuckle, Knob, Knot, Tune, Melody];[せつ, せち];[ふし, -ぶし, のっと];19;[Season];[せつ];[ふし];[Bamboo, Root, Stamp];période, moment, section, paragraphe nœud, jointure mélodie, air (de musique)
需;14;8.0;935.0;1.0;1.0;[Demand, Request, Need];[じゅ];[];38;[Demand];[じゅ];[];[Rain, Rake];demande, besoin, requête
骨;10;6.0;936.0;2.0;2.0;[Skeleton, Bone, Remains, Frame];[こつ];[ほね];14;[Bone];[こつ];[ほね];[Mustache, Forehead, Moon];os, armature
射;10;6.0;937.0;1.0;1.0;[Shoot, Shine Into, Onto, Archery];[しゃ];[い.る, さ.す, う.つ];34;[Shoot];[しゃ];[い, さ, う];[Body, Measurement];tirer, viser
傾;13;8.0;938.0;2.0;2.0;[Lean, Incline, Tilt, Trend, Wane, Sink, Ruin, Bias];[けい];[かたむ.く, かたむ.ける, かたぶ.く, かた.げる, かし.げる];38;[Lean];[けい];[かたむ];[Change, Geoduck];pencher, incliner, tendre se pencher, s'incliner
届;8;6.0;939.0;2.0;2.0;[Deliver, Reach, Arrive, Report, Notify, Forward];[かい];[とど.ける, -とど.け, とど.く];24;[Deliver];[];[とど];[Flag, Reason];atteindre, arriver déclarer, notifier
曜;18;2.0;940.0;3.0;4.0;[Weekday];[よう];[];16;[Weekday, Day Of The Week];[よう];[];[Sun, Wolverine, Turkey];jour de la semaine
遊;12;3.0;941.0;2.0;3.0;[Play];[ゆう, ゆ];[あそ.ぶ, あそ.ばす];30;[Play];[ゆう];[あそ];[Scooter, Direction, Gun, Child];se divertir, jouer
迷;9;5.0;942.0;2.0;3.0;[Astray, Be Perplexed, In Doubt, Lost, Err, Illusion];[めい];[まよ.う];27;[Astray, Lost];[めい];[まよ];[Scooter, Rice];être perdu, être égaré, douter
夢;13;5.0;943.0;2.0;3.0;[Dream, Vision, Illusion];[む, ぼう];[ゆめ, ゆめ.みる, くら.い];20;[Dream];[む];[ゆめ];[Flowers, Net, Forehead, Evening];rêve, illusion
巻;9;6.0;944.0;2.0;2.0;[Scroll, Volume, Book, Part, Roll Up, Wind Up, Tie, Coil, Counter For Texts (or Book Scrolls)];[かん, けん];[ま.く, まき, ま.き];25;[Scroll];[かん];[ま];[Gladiator, Oneself];rouleau, livre, volume enrouler
購;17;8.0;945.0;1.0;1.0;[Subscription, Buy];[こう];[];30;[Subscription];[こう];[];[Shellfish, Lifeguard];acheter, acquérir
揮;12;6.0;946.0;1.0;1.0;[Brandish, Wave, Wag, Swing, Shake];[き];[ふる.う];34;[Brandish];[き];[];[Fingers, Forehead, Car];secouer, brandir, agiter
君;7;3.0;947.0;2.0;3.0;[Mister, You, Ruler, Male Name Suffix];[くん];[きみ, -ぎみ];8;[Buddy];[くん];[きみ];[Wolverine, Slide, Mouth];toi (degré moins) suffixe de nom masculin (degré moins)
燃;16;5.0;948.0;2.0;2.0;[Burn, Blaze, Glow];[ねん];[も.える, も.やす, も.す];24;[Burn];[ねん];[も];[Fire, Nature];brûler, flamber
充;6;8.0;949.0;1.0;1.0;[Allot, Fill];[じゅう];[あ.てる, み.たす];39;[Allocate];[じゅう];[あ, み];[Allocate];remplir affecter, attribuer, destiner
雨;8;1.0;950.0;4.0;5.0;[Rain];[う];[あめ, あま-, -さめ];5;[Rain];[う];[あめ, あま];[Rain];pluie
閉;11;6.0;951.0;2.0;3.0;[Closed, Shut];[へい];[と.じる, と.ざす, し.める, し.まる, た.てる];33;[Closed, Close, Closure];[へい];[し, と];[Gate, Genius];fermer, clôre se fermer
緒;14;8.0;952.0;2.0;3.0;[Thong, Beginning, Inception, End, Cord, Strap, Mental Or Emotional State];[しょ, ちょ];[お, いとぐち];38;[Together];[しょ];[お];[Thread, Someone];début, commencement cordon, lannière, ficelle
跡;13;8.0;953.0;1.0;2.0;[Tracks, Mark, Print, Impression];[せき];[あと];37;[Traces];[せき];[あと];[Foot, Red];marque, trace, restes, vestiges
包;5;4.0;954.0;2.0;2.0;[Wrap, Pack Up, Cover, Conceal];[ほう];[つつ.む, くる.む];41;[Wrap];[ほう];[つつ, くる];[Wrap];envelopper, emballer
駐;15;8.0;955.0;2.0;2.0;[Stop-over, Reside In, Resident];[ちゅう];[];40;[Resident];[ちゅう];[];[Horse, Master];arrêt, demeurer, résider
貢;10;8.0;956.0;1.0;1.0;[Tribute, Support, Finance];[こう, く];[みつ.ぐ];43;[Tribute];[こう];[みつ];[Construction, Shellfish];aider financièrement
鹿;11;8.0;957.0;1.0;1.0;[Deer];[ろく];[しか, か];36;[Deer];[ろく];[か, しか];[Canopy, Helicopter, Compare];cerf, biche, faon
弱;10;2.0;958.0;3.0;2.0;[Weak, Frail];[じゃく];[よわ.い, よわ.る, よわ.まる, よわ.める];7;[Weak];[じゃく];[よわ];[Bow, Ice];faible, fragile, faiblir, être diminué, affaiblir, diminuer
却;7;8.0;959.0;1.0;1.0;[Instead, On The Contrary, Rather, Step Back, Withdraw, Retreat];[きゃく];[かえ.って, しりぞ.く, しりぞ.ける];38;[Contrary];[きゃく];[かえって];[Past, Stamp];écarter, repousser, rejeter
端;14;8.0;960.0;1.0;1.0;[Edge, Origin, End, Point, Border, Verge, Cape];[たん];[はし, は, はた, -ばた, はな];27;[Edge];[たん];[はし, はた];[Stand, Mountain, Rake];correct, exact, bout, extrémité extrémité, bord bord
賃;13;6.0;961.0;2.0;1.0;[Fare, Fee, Hire, Rent, Wages, Charge];[ちん];[];33;[Rent];[ちん];[];[Leader, King, Shellfish];paie, rentes, loyer
折;7;4.0;962.0;2.0;3.0;[Fold, Break, Fracture, Bend, Yield, Submit];[せつ, しゃく];[お.る, おり, お.り, -お.り, お.れる];14;[Fold, Bend];[せつ];[お];[Fingers, Axe];se briser, se plier, se fracturer briser, plier, fracturer occasion, moment
紹;11;8.0;963.0;2.0;2.0;[Introduce, Inherit, Help];[しょう];[];35;[Introduce];[しょう];[];[Thread, Call];présentation
獲;16;8.0;964.0;1.0;1.0;[Seize, Get, Find, Earn, Acquire, Can, May, Able To];[かく];[え.る];40;[Seize];[かく];[え];[Animal, Flowers, Turkey, Stool];acquérir, obtenir, capturer
郡;10;4.0;965.0;1.0;1.0;[County, District];[ぐん];[こおり];51;[County, District];[ぐん];[こおり];[Buddy, Building];arrondissement, district
併;8;8.0;966.0;1.0;1.0;[Join, Get Together, Unite, Collective];[へい];[あわ.せる];38;[Join];[へい];[あわ];[Leader, Horns, Lantern];réunir, unifier, fusionner
草;9;1.0;967.0;2.0;3.0;[Grass, Weeds, Herbs, Pasture, Write, Draft];[そう];[くさ, くさ-, -ぐさ];5;[Grass, Weed];[そう];[くさ];[Flowers, Sun, Cross];herbe, plantes, végétation
徹;15;8.0;968.0;1.0;1.0;[Penetrate, Clear, Pierce, Strike Home, Sit Up (all Night)];[てつ];[];41;[Penetrate, Clear];[てつ];[];[Loiter, Trash, Moon, Winter];percer, penétrer, passer à travers
飲;12;3.0;969.0;4.0;4.0;[Drink, Smoke, Take];[いん, おん];[の.む, -の.み];10;[Drink];[いん];[の];[Eat, Lack];boire
貴;12;6.0;970.0;1.0;1.0;[Precious, Value, Prize, Esteem, Honor];[き];[たっと.い, とうと.い, たっと.ぶ, とうと.ぶ];34;[Valuable];[き];[とうと];[Middle, Ground, Shellfish];précieux, de grande valeur, sacré apprécier, estimer, respecter
衝;15;8.0;972.0;1.0;1.0;[Collide, Brunt, Highway, Opposition (astronomy), Thrust, Pierce, Stab, Prick];[しょう];[つ.く];40;[Collide];[しょう];[つ];[Go, Heavy];collision
焦;12;8.0;973.0;1.0;1.0;[Char, Hurry, Impatient, Irritate, Burn, Scorch, Singe];[しょう];[こ.げる, こ.がす, こ.がれる, あせ.る];42;[Char];[しょう];[こ, あせ];[Turkey, Boil];brûler, s'impatienter brûler, roussir être brûlé, désirer ardemment
奪;14;8.0;974.0;1.0;1.0;[Rob, Take By Force, Snatch Away, Dispossess, Plunder, Usurp];[だつ];[うば.う];39;[Rob];[だつ];[うば];[Big, Turkey, Measurement];déposséder, ravir, usurper, ensorceler
雇;12;8.0;975.0;2.0;2.0;[Employ, Hire];[こ];[やと.う];39;[Employ];[こ];[やと];[Turkey, Door];engager, embaucher, employer
災;7;5.0;976.0;1.0;1.0;[Disaster, Calamity, Woe, Curse, Evil];[さい];[わざわ.い];20;[Disaster];[さい];[わざわ];[Flood, Fire];infortune, désastre, calamité
浦;10;8.0;977.0;1.0;1.0;[Bay, Creek, Inlet, Gulf, Beach, Seacoast];[ほ];[うら];51;[Bay];[ほ];[うら];[Tsunami, Wedding];anse, baie, crique, plage, rivage
暮;14;6.0;978.0;2.0;3.0;[Evening, Twilight, Seasons End, Livelihood, Make A Living, Spend Time],;[ぼ];[く.れる, く.らす];33;[Livelihood];[ぼ];[く];[Greenhouse, Sun];vivre, passer son temps à se terminer, s'achever fin
替;12;8.0;979.0;2.0;2.0;[Exchange, Spare, Substitute, Per-];[たい];[か.える, か.え-, か.わる];25;[Replace, Exchange];[たい];[か];[Husband, Sun];échanger, troquer, substituer
析;8;8.0;980.0;1.0;1.0;[Chop, Divide, Tear, Analyze];[せき];[];42;[Analysis];[せき];[];[Tree, Axe];diviser, analyser, séparer, casser
預;13;5.0;981.0;2.0;2.0;[Deposit, Custody, Leave With, Entrust To];[よ];[あず.ける, あず.かる];30;[Deposit];[よ];[あず];[Beforehand, Geoduck];se voir confier, recevoir en dépôt confier, remettre en dépôt
焼;12;4.0;982.0;2.0;2.0;[Bake, Burning];[しょう];[や.く, や.き, や.き-, -や.き, や.ける];18;[Bake, Cook, Burn];[しょう];[や];[Fire, Gambler];mettre le feu à, brûler, griller être brulé, être grillé
簡;18;6.0;983.0;2.0;2.0;[Simplicity, Brevity];[かん, けん];[えら.ぶ, ふだ];33;[Simplicity];[かん];[];[Bamboo, Interval];brièveté, simplicité
譲;20;8.0;984.0;1.0;1.0;[Defer, Turnover, Transfer, Convey];[じょう];[ゆず.る];39;[Defer];[じょう];[ゆず];[Say, Nurse];céder, fléchir, léguer, transférer
称;10;8.0;985.0;1.0;1.0;[Appellation, Praise, Admire, Name, Title, Fame];[しょう];[たた.える, とな.える, あ.げる, かな.う, はか.り, はか.る, ほめ.る];38;[Title];[しょう];[とな, たた, ほめ];[Grain, Gun, Small];désignation, titre, appellation
肉;6;2.0;986.0;3.0;4.0;[Meat];[にく];[しし];5;[Meat];[にく];[];[Meat];chair, viande
納;10;6.0;987.0;1.0;1.0;[Settlement, Obtain, Reap, Pay, Supply, Store];[のう, なっ, な, なん, とう];[おさ.める, -おさ.める, おさ.まる];33;[Supply];[のう];[おさ, なっ];[Thread, Inside];régler, fournir, livrer, emmagasiner être acquitté, très bien s'adapter
樹;16;6.0;988.0;1.0;1.0;[Timber, Trees, Wood, Establish, Set Up];[じゅ];[き];41;[Wood];[じゅ];[き];[Tree, Drum, Measurement];arbre, végétation
挑;9;8.0;989.0;1.0;1.0;[Challenge, Contend For, Make Love To];[ちょう];[いど.む];42;[Challenge];[ちょう];[いど];[Fingers, Omen];défier, provoquer, braver
章;11;3.0;990.0;2.0;2.0;[Badge, Chapter, Composition, Poem, Design];[しょう];[];12;[Chapter];[しょう];[];[Stand, Early];chapitre, insigne, médaille
臓;19;6.0;991.0;2.0;2.0;[Entrails, Viscera, Bowels];[ぞう];[はらわた];34;[Internal Organs];[ぞう];[];[Moon, Storehouse];viscères
律;9;6.0;992.0;2.0;2.0;[Rhythm, Law, Regulation, Gauge, Control];[りつ, りち, れつ];[];23;[Law];[りつ];[];[Loiter, Brush];loi, règlement
誘;14;8.0;993.0;1.0;1.0;[Entice, Lead, Tempt, Invite, Ask, Call For, Seduce, Allure];[ゆう];[さそ.う, いざな.う];27;[Invite];[ゆう];[さそ];[Say, Grain, Stairs];inviter, inciter, pousser
紛;10;8.0;994.0;1.0;1.0;[Distract, Be Mistaken For, Go Astray, Divert];[ふん];[まぎ.れる, -まぎ.れ, まぎ.らす, まぎ.らわす, まぎ.らわしい];42;[Distract];[ふん];[まぎ, まぐ];[Thread, Part];être difficile à distinguer, s'égarer obsurcir, tromper équivoque, confus, ambigu
貸;12;5.0;995.0;3.0;4.0;[Lend];[たい];[か.す, か.し-, かし-];27;[Lend];[たい];[か];[Substitute, Shellfish];prêter
至;6;6.0;996.0;1.0;1.0;[Climax, Arrive, Proceed, Reach, Attain, Result In];[し];[いた.る];41;[Attain];[し];[いた];[Mole];extrême arriver à, conduire à
宗;8;6.0;997.0;1.0;1.0;[Religion, Sect, Denomination, Main Point, Origin, Essence];[しゅう, そう];[むね];29;[Religion];[しゅう];[];[Roof, Jackhammer];fondation, source, origine
促;9;8.0;998.0;1.0;1.0;[Stimulate, Urge, Press, Demand, Incite];[そく];[うなが.す];29;[Urge];[そく];[うなが];[Leader, Foot];presser, exhorter, insister
慎;13;8.0;999.0;1.0;1.0;[Humility, Be Careful, Discreet, Prudent];[しん];[つつし.む, つつ.ましい, つつし, つつし.み];39;[Humility];[しん];[つつし];[Soul, Reality];être circonspect, être prudent
控;11;8.0;1000.0;1.0;1.0;[Withdraw, Draw In, Hold Back, Refrain From, Be Moderate];[こう];[ひか.える, ひか.え];39;[Abstain];[こう];[ひか];[Fingers, Sky];s'abstenir, se restreindre, se modérer
贈;18;8.0;1001.0;2.0;2.0;[Presents, Send, Give To, Award To, Confer On, Presenting Something];[ぞう, そう];[おく.る];38;[Presents];[ぞう];[おく];[Shellfish, Mask];offrir, conférer
握;12;8.0;1003.0;1.0;1.0;[Grip, Hold, Mould Sushi, Bribe];[あく];[にぎ.る];42;[Grip];[あく];[にぎ];[Fingers, Shop];empoigner, saisir, prendre
照;13;4.0;1004.0;2.0;2.0;[Illuminate, Shine, Compare, Bashful];[しょう];[て.る, て.らす, て.れる];30;[Illuminate];[しょう];[て];[Sun, Call, Boil];briller, éclairer, se sentir gêné
宙;8;6.0;1005.0;2.0;1.0;[Mid-air, Air, Space, Sky, Memorization, Interval Of Time];[ちゅう];[];19;[Midair];[ちゅう];[];[Roof, Reason];air, espace
